"No.","Time","Source","Destination","Protocol","Length","Info"
"1","0.000000000","10.1.3.206","140.82.112.22","TLSv1.2","133","Application Data"
"2","0.000084300","10.1.3.206","140.82.112.22","TLSv1.2","16460","Application Data"
"3","0.000148400","10.1.3.206","140.82.112.22","TCP","11542","58501  >  443 [ACK] Seq=16486 Ack=1 Win=253 Len=11488 [TCP PDU reassembled in 11]"
"4","0.008548900","140.82.112.22","10.1.3.206","TCP","60","443  >  58501 [ACK] Seq=1 Ack=1516 Win=96 Len=0"
"5","0.008614300","10.1.3.206","140.82.112.22","TCP","2926","58501  >  443 [ACK] Seq=27974 Ack=1 Win=253 Len=2872 [TCP PDU reassembled in 11]"
"6","0.008720000","140.82.112.22","10.1.3.206","TCP","60","443  >  58501 [ACK] Seq=1 Ack=14440 Win=121 Len=0"
"7","0.008720000","140.82.112.22","10.1.3.206","TCP","60","443  >  58501 [ACK] Seq=1 Ack=16486 Win=125 Len=0"
"8","0.008720000","140.82.112.22","10.1.3.206","TCP","60","443  >  58501 [ACK] Seq=1 Ack=19358 Win=131 Len=0"
"9","0.008720000","140.82.112.22","10.1.3.206","TCP","60","443  >  58501 [ACK] Seq=1 Ack=23666 Win=139 Len=0"
"10","0.008720000","140.82.112.22","10.1.3.206","TCP","60","443  >  58501 [ACK] Seq=1 Ack=27974 Win=144 Len=0"
"11","0.008814300","10.1.3.206","140.82.112.22","TLSv1.2","10585","Application Data, Application Data"
"12","0.009386200","140.82.112.22","10.1.3.206","TLSv1.2","102","Application Data"
"13","0.017097500","140.82.112.22","10.1.3.206","TCP","60","443  >  58501 [ACK] Seq=49 Ack=30846 Win=150 Len=0"
"14","0.017306300","140.82.112.22","10.1.3.206","TCP","60","443  >  58501 [ACK] Seq=49 Ack=41377 Win=162 Len=0"
"15","0.017306300","140.82.112.22","10.1.3.206","TLSv1.2","102","Application Data"
"16","0.017391400","10.1.3.206","140.82.112.22","TCP","54","58501  >  443 [ACK] Seq=41377 Ack=97 Win=253 Len=0"
"17","0.041618700","140.82.112.22","10.1.3.206","TLSv1.2","545","Application Data"
"18","0.093764900","10.1.3.206","140.82.112.22","TCP","54","58501  >  443 [ACK] Seq=41377 Ack=588 Win=251 Len=0"
"19","0.283525900","3.210.227.162","10.2.11.202","TLSv1.2","101","Encrypted Alert"
"20","0.770140400","10.1.3.206","20.189.173.28","TLSv1.2","138","Application Data"
"21","0.770224400","10.1.3.206","20.189.173.28","TLSv1.2","904","Application Data"
"22","0.843456100","20.189.173.28","10.1.3.206","TCP","60","443  >  50689 [ACK] Seq=1 Ack=935 Win=16381 Len=0"
"23","1.029710300","20.189.173.28","10.1.3.206","TLSv1.2","154","Application Data"
"24","1.031024500","10.1.3.206","20.189.173.28","TLSv1.2","89","Application Data"
"25","1.150971000","20.189.173.28","10.1.3.206","TCP","60","443  >  50689 [ACK] Seq=101 Ack=970 Win=16381 Len=0"
"26","4.305979500","4.153.72.49","10.1.3.206","TLSv1.2","78","Application Data"
"27","4.305979500","4.153.72.49","10.1.3.206","TCP","60","443  >  52633 [FIN, ACK] Seq=25 Ack=1 Win=501 Len=0"
"28","4.306121100","10.1.3.206","4.153.72.49","TCP","54","52633  >  443 [ACK] Seq=1 Ack=26 Win=255 Len=0"
"29","4.494857900","146.75.35.51","10.1.75.216","TLSv1.2","145","Application Data, Application Data"
"30","4.748563100","10.1.3.206","140.82.112.22","TLSv1.2","132","Application Data"
"31","4.748658100","10.1.3.206","140.82.112.22","TLSv1.2","1406","Application Data"
"32","4.757731300","140.82.112.22","10.1.3.206","TCP","60","443  >  58501 [ACK] Seq=588 Ack=42807 Win=165 Len=0"
"33","4.757731300","140.82.112.22","10.1.3.206","TLSv1.2","102","Application Data"
"34","4.771900900","140.82.112.22","10.1.3.206","TLSv1.2","545","Application Data"
"35","4.772093800","10.1.3.206","140.82.112.22","TCP","54","58501  >  443 [ACK] Seq=42807 Ack=1127 Win=255 Len=0"
"36","4.778896600","10.1.3.206","140.82.112.22","TLSv1.2","132","Application Data"
"37","4.779024400","10.1.3.206","140.82.112.22","TLSv1.2","1398","Application Data"
"38","4.783850800","10.1.3.206","140.82.112.22","TLSv1.2","133","Application Data"
"39","4.784057300","10.1.3.206","140.82.112.22","TLSv1.2","16460","Application Data"
"40","4.784228100","10.1.3.206","140.82.112.22","TLSv1.2","10079","Application Data"
"41","4.785227700","10.1.3.206","140.82.112.22","TLSv1.2","132","Application Data"
"42","4.785382300","10.1.3.206","140.82.112.22","TLSv1.2","1526","Application Data"
"43","4.787416100","10.1.3.206","140.82.114.3","TLSv1.2","563","Application Data"
"44","4.788463800","140.82.112.22","10.1.3.206","TCP","60","443  >  58501 [ACK] Seq=1127 Ack=44229 Win=168 Len=0"
"45","4.788463800","140.82.112.22","10.1.3.206","TLSv1.2","102","Application Data"
"46","4.793338200","140.82.112.22","10.1.3.206","TCP","60","443  >  58501 [ACK] Seq=1175 Ack=45744 Win=170 Len=0"
"47","4.793338200","140.82.112.22","10.1.3.206","TCP","60","443  >  58501 [ACK] Seq=1175 Ack=60714 Win=156 Len=0"
"48","4.793338200","140.82.112.22","10.1.3.206","TCP","60","443  >  58501 [ACK] Seq=1175 Ack=62150 Win=155 Len=0"
"49","4.793338200","140.82.112.22","10.1.3.206","TCP","60","443  >  58501 [ACK] Seq=1175 Ack=63586 Win=154 Len=0"
"50","4.793338200","140.82.112.22","10.1.3.206","TCP","60","443  >  58501 [ACK] Seq=1175 Ack=65022 Win=153 Len=0"
"51","4.793526600","140.82.112.22","10.1.3.206","TCP","60","443  >  58501 [ACK] Seq=1175 Ack=66458 Win=152 Len=0"
"52","4.793526600","140.82.112.22","10.1.3.206","TCP","60","443  >  58501 [ACK] Seq=1175 Ack=67894 Win=151 Len=0"
"53","4.793526600","140.82.112.22","10.1.3.206","TCP","60","443  >  58501 [ACK] Seq=1175 Ack=69330 Win=150 Len=0"
"54","4.793526600","140.82.112.22","10.1.3.206","TCP","60","443  >  58501 [ACK] Seq=1175 Ack=70739 Win=149 Len=0"
"55","4.793783100","140.82.112.22","10.1.3.206","TLSv1.2","102","Application Data"
"56","4.793985800","10.1.3.206","140.82.112.22","TCP","54","58501  >  443 [ACK] Seq=72289 Ack=1223 Win=255 Len=0"
"57","4.794672600","140.82.112.22","10.1.3.206","TCP","60","443  >  58501 [ACK] Seq=1223 Ack=72289 Win=173 Len=0"
"58","4.795634500","10.1.3.206","140.82.112.22","TLSv1.2","132","Application Data"
"59","4.795719700","10.1.3.206","140.82.112.22","TLSv1.2","1459","Application Data"
"60","4.795799900","10.1.3.206","185.199.108.133","TLSv1.2","128","Application Data"
"61","4.797723400","140.82.114.3","10.1.3.206","TCP","60","443  >  53056 [ACK] Seq=1 Ack=510 Win=104 Len=0"
"62","4.801168800","140.82.112.22","10.1.3.206","TLSv1.2","102","Application Data"
"63","4.801589000","140.82.112.22","10.1.3.206","TLSv1.2","545","Application Data"
"64","4.801700900","10.1.3.206","140.82.112.22","TCP","54","58501  >  443 [ACK] Seq=73772 Ack=1762 Win=253 Len=0"
"65","4.803802300","185.199.108.133","10.1.3.206","TCP","60","443  >  57616 [ACK] Seq=1 Ack=75 Win=282 Len=0"
"66","4.804096200","140.82.112.22","10.1.3.206","TCP","60","443  >  58501 [ACK] Seq=1762 Ack=73772 Win=175 Len=0"
"67","4.804271800","140.82.112.22","10.1.3.206","TLSv1.2","102","Application Data"
"68","4.806151200","185.199.108.133","10.1.3.206","TLSv1.2","313","Application Data"
"69","4.810837600","140.82.112.22","10.1.3.206","TLSv1.2","545","Application Data"
"70","4.810975100","10.1.3.206","140.82.112.22","TCP","54","58501  >  443 [ACK] Seq=73772 Ack=2301 Win=251 Len=0"
"71","4.811932900","140.82.112.22","10.1.3.206","TLSv1.2","545","Application Data"
"72","4.813929900","140.82.112.22","10.1.3.206","TLSv1.2","545","Application Data"
"73","4.814140600","10.1.3.206","140.82.112.22","TCP","54","58501  >  443 [ACK] Seq=73772 Ack=3283 Win=255 Len=0"
"74","4.826772000","185.199.108.133","10.1.3.206","TCP","313","[TCP Retransmission] 443  >  57616 [PSH, ACK] Seq=1 Ack=75 Win=282 Len=259"
"75","4.826905600","10.1.3.206","185.199.108.133","TCP","66","57616  >  443 [ACK] Seq=75 Ack=260 Win=253 Len=0 SLE=1 SRE=260"
"76","4.896596700","140.82.114.3","10.1.3.206","TLSv1.2","1490","Application Data"
"77","4.896596700","140.82.114.3","10.1.3.206","TLSv1.2","1490","Application Data"
"78","4.896596700","140.82.114.3","10.1.3.206","TLSv1.2","1490","Application Data"
"79","4.896596700","140.82.114.3","10.1.3.206","TLSv1.2","421","Application Data"
"80","4.896853300","10.1.3.206","140.82.114.3","TCP","54","53056  >  443 [ACK] Seq=510 Ack=2873 Win=1023 Len=0"
"81","4.896938600","10.1.3.206","140.82.114.3","TCP","54","53056  >  443 [ACK] Seq=510 Ack=4676 Win=1023 Len=0"
"82","4.913676900","10.1.3.206","140.82.112.22","TLSv1.2","132","Application Data"
"83","4.913797200","10.1.3.206","140.82.112.22","TLSv1.2","1663","Application Data"
"84","4.914018800","10.1.3.206","140.82.112.22","TLSv1.2","132","Application Data"
"85","4.914088500","10.1.3.206","140.82.112.22","TLSv1.2","1486","Application Data"
"86","4.915315200","10.1.3.206","140.82.112.22","TLSv1.2","132","Application Data"
"87","4.915384600","10.1.3.206","140.82.112.22","TLSv1.2","1597","Application Data"
"88","4.922416800","140.82.112.22","10.1.3.206","TCP","60","443  >  58501 [ACK] Seq=3283 Ack=75459 Win=179 Len=0"
"89","4.922532500","140.82.112.22","10.1.3.206","TCP","60","443  >  58501 [ACK] Seq=3283 Ack=76969 Win=181 Len=0"
"90","4.923311400","140.82.112.22","10.1.3.206","TLSv1.2","115","Application Data"
"91","4.923777200","140.82.112.22","10.1.3.206","TCP","60","443  >  58501 [ACK] Seq=3344 Ack=78590 Win=184 Len=0"
"92","4.924376900","140.82.112.22","10.1.3.206","TLSv1.2","102","Application Data"
"93","4.924450700","10.1.3.206","140.82.112.22","TCP","54","58501  >  443 [ACK] Seq=78590 Ack=3392 Win=255 Len=0"
"94","4.937594800","140.82.112.22","10.1.3.206","TLSv1.2","545","Application Data"
"95","4.941803100","140.82.112.22","10.1.3.206","TLSv1.2","545","Application Data"
"96","4.941865700","10.1.3.206","140.82.112.22","TCP","54","58501  >  443 [ACK] Seq=78590 Ack=4374 Win=251 Len=0"
"97","4.950649600","140.82.112.22","10.1.3.206","TLSv1.2","545","Application Data"
"98","4.995963800","10.1.3.206","140.82.112.22","TCP","54","58501  >  443 [ACK] Seq=78590 Ack=4865 Win=255 Len=0"
"99","6.559620200","10.1.3.206","140.82.112.22","TLSv1.2","132","Application Data"
"100","6.559732400","10.1.3.206","140.82.112.22","TLSv1.2","1391","Application Data"
"101","6.569937200","140.82.112.22","10.1.3.206","TCP","60","443  >  58501 [ACK] Seq=4865 Ack=80005 Win=187 Len=0"
"102","6.569937200","140.82.112.22","10.1.3.206","TLSv1.2","102","Application Data"
"103","6.580672100","140.82.112.22","10.1.3.206","TLSv1.2","545","Application Data"
"104","6.580783000","10.1.3.206","140.82.112.22","TCP","54","58501  >  443 [ACK] Seq=80005 Ack=5404 Win=253 Len=0"
"105","6.583526400","10.1.3.206","185.199.108.215","QUIC","1292","Initial, DCID=263cda128d854161, PKN: 1, PING, CRYPTO, PING, CRYPTO, CRYPTO, PING, PADDING, CRYPTO, PADDING, CRYPTO, PADDING, PING, CRYPTO, CRYPTO, PING, CRYPTO, CRYPTO"
"106","6.583598400","10.1.3.206","185.199.108.215","QUIC","1292","Initial, DCID=263cda128d854161, PKN: 2, PADDING, PING, PADDING, CRYPTO, PING, CRYPTO, PADDING, PING, CRYPTO"
"107","6.583715700","10.1.3.206","140.82.114.3","TLSv1.2","1139","Application Data"
"108","6.592101100","185.199.108.215","10.1.3.206","QUIC","1322","Initial, SCID=3f68d224632aebed0b86259d4cd0cac85a, PKN: 0, ACK, PADDING"
"109","6.592403300","140.82.114.3","10.1.3.206","TCP","60","443  >  53056 [ACK] Seq=4676 Ack=1595 Win=107 Len=0"
"110","6.593934000","185.199.108.215","10.1.3.206","QUIC","1322","Initial, SCID=3f68d224632aebed0b86259d4cd0cac85a, PKN: 1, ACK, CRYPTO, PADDING"
"111","6.593934000","185.199.108.215","10.1.3.206","QUIC","620","Protected Payload (KP0)"
"112","6.594537500","10.1.3.206","185.199.108.215","QUIC","232","Protected Payload (KP0), DCID=3f68d224632aebed0b86259d4cd0cac85a"
"113","6.603785800","185.199.108.215","10.1.3.206","QUIC","67","Protected Payload (KP0)"
"114","6.643640300","10.1.3.206","185.199.108.215","QUIC","83","Protected Payload (KP0), DCID=3f68d224632aebed0b86259d4cd0cac85a"
"115","6.651776800","185.199.108.215","10.1.3.206","QUIC","63","Protected Payload (KP0)"
"116","6.678748100","10.1.3.206","185.199.108.215","QUIC","83","Protected Payload (KP0), DCID=3f68d224632aebed0b86259d4cd0cac85a"
"117","7.392590000","140.82.114.3","10.1.3.206","TLSv1.2","1490","Application Data"
"118","7.392590000","140.82.114.3","10.1.3.206","TLSv1.2","1490","Application Data"
"119","7.392590000","140.82.114.3","10.1.3.206","TLSv1.2","1490","Application Data"
"120","7.392590000","140.82.114.3","10.1.3.206","TLSv1.2","1490","Application Data"
"121","7.392590000","140.82.114.3","10.1.3.206","TLSv1.2","1490","Application Data"
"122","7.392590000","140.82.114.3","10.1.3.206","TLSv1.2","1490","Application Data"
"123","7.392590000","140.82.114.3","10.1.3.206","TLSv1.2","1490","Application Data"
"124","7.392590000","140.82.114.3","10.1.3.206","TLSv1.2","1490","Application Data"
"125","7.392590000","140.82.114.3","10.1.3.206","TLSv1.2","1490","Application Data"
"126","7.392590000","140.82.114.3","10.1.3.206","TLSv1.2","1490","Application Data"
"127","7.392590000","140.82.114.3","10.1.3.206","TLSv1.2","1490","Application Data"
"128","7.392590000","140.82.114.3","10.1.3.206","TLSv1.2","1490","Application Data"
"129","7.392590000","140.82.114.3","10.1.3.206","TLSv1.2","1490","Application Data"
"130","7.392590000","140.82.114.3","10.1.3.206","TLSv1.2","1490","Application Data"
"131","7.393118600","10.1.3.206","140.82.114.3","TCP","54","53056  >  443 [ACK] Seq=1595 Ack=7548 Win=1023 Len=0"
"132","7.393064300","140.82.114.3","10.1.3.206","TLSv1.2","1490","Application Data, Application Data"
"133","7.393064300","140.82.114.3","10.1.3.206","TLSv1.2","1490","Application Data"
"134","7.393064300","140.82.114.3","10.1.3.206","TLSv1.2","1490","Application Data"
"135","7.393064300","140.82.114.3","10.1.3.206","TLSv1.2","1490","Application Data"
"136","7.393218200","10.1.3.206","140.82.114.3","TCP","54","53056  >  443 [ACK] Seq=1595 Ack=10420 Win=1023 Len=0"
"137","7.393064300","140.82.114.3","10.1.3.206","TLSv1.2","1490","Application Data"
"138","7.393064300","140.82.114.3","10.1.3.206","TLSv1.2","1490","Application Data"
"139","7.393064300","140.82.114.3","10.1.3.206","TLSv1.2","1490","Application Data"
"140","7.393064300","140.82.114.3","10.1.3.206","TLSv1.2","1490","Application Data"
"141","7.393064300","140.82.114.3","10.1.3.206","TLSv1.2","1490","Application Data"
"142","7.393246100","10.1.3.206","140.82.114.3","TCP","54","53056  >  443 [ACK] Seq=1595 Ack=13292 Win=1023 Len=0"
"143","7.393064300","140.82.114.3","10.1.3.206","TLSv1.2","1490","Application Data"
"144","7.393064300","140.82.114.3","10.1.3.206","TLSv1.2","1490","Application Data"
"145","7.393064300","140.82.114.3","10.1.3.206","TLSv1.2","865","Application Data"
"146","7.393064300","140.82.114.3","10.1.3.206","TLSv1.2","1490","Application Data"
"147","7.393064300","140.82.114.3","10.1.3.206","TLSv1.2","1490","Application Data"
"148","7.393064300","140.82.114.3","10.1.3.206","TLSv1.2","1490","Application Data"
"149","7.393289500","10.1.3.206","140.82.114.3","TCP","54","53056  >  443 [ACK] Seq=1595 Ack=16164 Win=1023 Len=0"
"150","7.393064300","140.82.114.3","10.1.3.206","TLSv1.2","1490","Application Data"
"151","7.393379700","10.1.3.206","140.82.114.3","TCP","54","53056  >  443 [ACK] Seq=1595 Ack=19036 Win=1023 Len=0"
"152","7.393373500","140.82.114.3","10.1.3.206","TLSv1.2","1490","Application Data"
"153","7.393410100","10.1.3.206","140.82.114.3","TCP","54","53056  >  443 [ACK] Seq=1595 Ack=21908 Win=1023 Len=0"
"154","7.393373500","140.82.114.3","10.1.3.206","TLSv1.2","1490","Application Data"
"155","7.393373500","140.82.114.3","10.1.3.206","TLSv1.2","1490","Application Data"
"156","7.393373500","140.82.114.3","10.1.3.206","TLSv1.2","1490","Application Data"
"157","7.393373500","140.82.114.3","10.1.3.206","TLSv1.2","1490","Application Data"
"158","7.393373500","140.82.114.3","10.1.3.206","TLSv1.2","1490","Application Data"
"159","7.393456300","10.1.3.206","140.82.114.3","TCP","54","53056  >  443 [ACK] Seq=1595 Ack=24780 Win=1023 Len=0"
"160","7.393373500","140.82.114.3","10.1.3.206","TLSv1.2","1490","Application Data"
"161","7.393373500","140.82.114.3","10.1.3.206","TLSv1.2","1490","Application Data"
"162","7.393373500","140.82.114.3","10.1.3.206","TLSv1.2","824","Application Data"
"163","7.393538400","10.1.3.206","140.82.114.3","TCP","54","53056  >  443 [ACK] Seq=1595 Ack=27652 Win=1023 Len=0"
"164","7.393565700","10.1.3.206","140.82.114.3","TCP","54","53056  >  443 [ACK] Seq=1595 Ack=30524 Win=1023 Len=0"
"165","7.393598500","10.1.3.206","140.82.114.3","TCP","54","53056  >  443 [ACK] Seq=1595 Ack=33396 Win=1023 Len=0"
"166","7.393622200","10.1.3.206","140.82.114.3","TCP","54","53056  >  443 [ACK] Seq=1595 Ack=36268 Win=1023 Len=0"
"167","7.393647000","10.1.3.206","140.82.114.3","TCP","54","53056  >  443 [ACK] Seq=1595 Ack=39140 Win=1023 Len=0"
"168","7.393675000","10.1.3.206","140.82.114.3","TCP","54","53056  >  443 [ACK] Seq=1595 Ack=41387 Win=1023 Len=0"
"169","7.393699300","10.1.3.206","140.82.114.3","TCP","54","53056  >  443 [ACK] Seq=1595 Ack=44259 Win=1023 Len=0"
"170","7.393766300","10.1.3.206","140.82.114.3","TCP","54","53056  >  443 [ACK] Seq=1595 Ack=47131 Win=1023 Len=0"
"171","7.393804200","10.1.3.206","140.82.114.3","TCP","54","53056  >  443 [ACK] Seq=1595 Ack=50003 Win=1023 Len=0"
"172","7.393837900","10.1.3.206","140.82.114.3","TCP","54","53056  >  443 [ACK] Seq=1595 Ack=52875 Win=1023 Len=0"
"173","7.393864600","10.1.3.206","140.82.114.3","TCP","54","53056  >  443 [ACK] Seq=1595 Ack=55747 Win=1023 Len=0"
"174","7.393888000","10.1.3.206","140.82.114.3","TCP","54","53056  >  443 [ACK] Seq=1595 Ack=58619 Win=1023 Len=0"
"175","7.395343400","140.82.114.3","10.1.3.206","TLSv1.2","1490","Application Data"
"176","7.395343400","140.82.114.3","10.1.3.206","TLSv1.2","1490","Application Data"
"177","7.395343400","140.82.114.3","10.1.3.206","TLSv1.2","1490","Application Data"
"178","7.395343400","140.82.114.3","10.1.3.206","TLSv1.2","1490","Application Data"
"179","7.395343400","140.82.114.3","10.1.3.206","TLSv1.2","1490","Application Data"
"180","7.395343400","140.82.114.3","10.1.3.206","TLSv1.2","1490","Application Data"
"181","7.395343400","140.82.114.3","10.1.3.206","TLSv1.2","1490","Application Data"
"182","7.395343400","140.82.114.3","10.1.3.206","TLSv1.2","1490","Application Data"
"183","7.395343400","140.82.114.3","10.1.3.206","TLSv1.2","1490","Application Data"
"184","7.395343400","140.82.114.3","10.1.3.206","TLSv1.2","1490","Application Data"
"185","7.395587700","10.1.3.206","140.82.114.3","TCP","54","53056  >  443 [ACK] Seq=1595 Ack=60825 Win=1023 Len=0"
"186","7.395573100","140.82.114.3","10.1.3.206","TLSv1.2","1490","Application Data"
"187","7.395573100","140.82.114.3","10.1.3.206","TLSv1.2","915","Application Data"
"188","7.395573100","140.82.114.3","10.1.3.206","TLSv1.2","1490","Application Data"
"189","7.395573100","140.82.114.3","10.1.3.206","TLSv1.2","1490","Application Data"
"190","7.395667200","10.1.3.206","140.82.114.3","TCP","54","53056  >  443 [ACK] Seq=1595 Ack=63697 Win=1023 Len=0"
"191","7.395573100","140.82.114.3","10.1.3.206","TLSv1.2","1490","Application Data"
"192","7.395573100","140.82.114.3","10.1.3.206","TLSv1.2","1490","Application Data"
"193","7.395573100","140.82.114.3","10.1.3.206","TLSv1.2","1490","Application Data"
"194","7.395573100","140.82.114.3","10.1.3.206","TLSv1.2","1490","Application Data"
"195","7.395573100","140.82.114.3","10.1.3.206","TLSv1.2","1490","Application Data"
"196","7.395721400","10.1.3.206","140.82.114.3","TCP","54","53056  >  443 [ACK] Seq=1595 Ack=66569 Win=1023 Len=0"
"197","7.395573100","140.82.114.3","10.1.3.206","TLSv1.2","1490","Application Data"
"198","7.395573100","140.82.114.3","10.1.3.206","TLSv1.2","1490","Application Data"
"199","7.395573100","140.82.114.3","10.1.3.206","TLSv1.2","1490","Application Data"
"200","7.395573100","140.82.114.3","10.1.3.206","TLSv1.2","1490","Application Data"
"201","7.395573100","140.82.114.3","10.1.3.206","TLSv1.2","915","Application Data"
"202","7.395762100","10.1.3.206","140.82.114.3","TCP","54","53056  >  443 [ACK] Seq=1595 Ack=69441 Win=1023 Len=0"
"203","7.395573100","140.82.114.3","10.1.3.206","TLSv1.2","1490","Application Data"
"204","7.395573100","140.82.114.3","10.1.3.206","TLSv1.2","1490","Application Data"
"205","7.395917500","10.1.3.206","140.82.114.3","TCP","54","53056  >  443 [ACK] Seq=1595 Ack=72313 Win=1023 Len=0"
"206","7.395914800","140.82.114.3","10.1.3.206","TLSv1.2","1490","Application Data"
"207","7.395914800","140.82.114.3","10.1.3.206","TLSv1.2","1490","Application Data"
"208","7.395914800","140.82.114.3","10.1.3.206","TLSv1.2","1490","Application Data"
"209","7.395914800","140.82.114.3","10.1.3.206","TLSv1.2","1490","Application Data"
"210","7.395986300","10.1.3.206","140.82.114.3","TCP","54","53056  >  443 [ACK] Seq=1595 Ack=75185 Win=1023 Len=0"
"211","7.395914800","140.82.114.3","10.1.3.206","TLSv1.2","1490","Application Data"
"212","7.395914800","140.82.114.3","10.1.3.206","TLSv1.2","1490","Application Data"
"213","7.395914800","140.82.114.3","10.1.3.206","TLSv1.2","1490","Application Data"
"214","7.395914800","140.82.114.3","10.1.3.206","TLSv1.2","1490","Application Data"
"215","7.395914800","140.82.114.3","10.1.3.206","TLSv1.2","1490","Application Data"
"216","7.395914800","140.82.114.3","10.1.3.206","TLSv1.2","915","Application Data"
"217","7.396019300","10.1.3.206","140.82.114.3","TCP","54","53056  >  443 [ACK] Seq=1595 Ack=77482 Win=1023 Len=0"
"218","7.395914800","140.82.114.3","10.1.3.206","TLSv1.2","1490","Application Data"
"219","7.395914800","140.82.114.3","10.1.3.206","TLSv1.2","1490","Application Data"
"220","7.395914800","140.82.114.3","10.1.3.206","TLSv1.2","1490","Application Data"
"221","7.395914800","140.82.114.3","10.1.3.206","TLSv1.2","1490","Application Data"
"222","7.395914800","140.82.114.3","10.1.3.206","TLSv1.2","1490","Application Data"
"223","7.395914800","140.82.114.3","10.1.3.206","TLSv1.2","1490","Application Data"
"224","7.396058200","10.1.3.206","140.82.114.3","TCP","54","53056  >  443 [ACK] Seq=1595 Ack=80354 Win=1023 Len=0"
"225","7.396091500","10.1.3.206","140.82.114.3","TCP","54","53056  >  443 [ACK] Seq=1595 Ack=83226 Win=1023 Len=0"
"226","7.396116100","10.1.3.206","140.82.114.3","TCP","54","53056  >  443 [ACK] Seq=1595 Ack=86098 Win=1023 Len=0"
"227","7.396162000","10.1.3.206","140.82.114.3","TCP","54","53056  >  443 [ACK] Seq=1595 Ack=88970 Win=1023 Len=0"
"228","7.396266300","10.1.3.206","140.82.114.3","TCP","54","53056  >  443 [ACK] Seq=1595 Ack=91842 Win=1023 Len=0"
"229","7.396292100","10.1.3.206","140.82.114.3","TCP","54","53056  >  443 [ACK] Seq=1595 Ack=94139 Win=1023 Len=0"
"230","7.396259800","140.82.114.3","10.1.3.206","TLSv1.2","1490","Application Data"
"231","7.396259800","140.82.114.3","10.1.3.206","TLSv1.2","1490","Application Data"
"232","7.396259800","140.82.114.3","10.1.3.206","TLSv1.2","1490","Application Data"
"233","7.396323500","10.1.3.206","140.82.114.3","TCP","54","53056  >  443 [ACK] Seq=1595 Ack=97011 Win=1023 Len=0"
"234","7.396259800","140.82.114.3","10.1.3.206","TLSv1.2","1490","Application Data"
"235","7.396259800","140.82.114.3","10.1.3.206","TLSv1.2","1490","Application Data"
"236","7.396259800","140.82.114.3","10.1.3.206","TLSv1.2","915","Application Data"
"237","7.396259800","140.82.114.3","10.1.3.206","TLSv1.2","1490","Application Data"
"238","7.396259800","140.82.114.3","10.1.3.206","TLSv1.2","1490","Application Data"
"239","7.396259800","140.82.114.3","10.1.3.206","TLSv1.2","273","Application Data"
"240","7.396356600","10.1.3.206","140.82.114.3","TLSv1.2","89","Application Data"
"241","7.396259800","140.82.114.3","10.1.3.206","TLSv1.2","1490","Application Data"
"242","7.396259800","140.82.114.3","10.1.3.206","TLSv1.2","382","Application Data"
"243","7.396259800","140.82.114.3","10.1.3.206","TLSv1.2","85","Application Data"
"244","7.396469400","10.1.3.206","140.82.114.3","TCP","54","53056  >  443 [ACK] Seq=1630 Ack=99883 Win=1023 Len=0"
"245","7.396508800","10.1.3.206","140.82.114.3","TCP","54","53056  >  443 [ACK] Seq=1630 Ack=101319 Win=1023 Len=0"
"246","7.396530500","10.1.3.206","140.82.114.3","TCP","54","53056  >  443 [ACK] Seq=1630 Ack=102755 Win=1023 Len=0"
"247","7.396556100","10.1.3.206","140.82.114.3","TCP","54","53056  >  443 [ACK] Seq=1630 Ack=104191 Win=1023 Len=0"
"248","7.396577000","10.1.3.206","140.82.114.3","TCP","54","53056  >  443 [ACK] Seq=1630 Ack=105627 Win=1023 Len=0"
"249","7.396594300","10.1.3.206","140.82.114.3","TCP","54","53056  >  443 [ACK] Seq=1630 Ack=107063 Win=1023 Len=0"
"250","7.396617700","10.1.3.206","140.82.114.3","TCP","54","53056  >  443 [ACK] Seq=1630 Ack=108499 Win=1023 Len=0"
"251","7.396637600","10.1.3.206","140.82.114.3","TCP","54","53056  >  443 [ACK] Seq=1630 Ack=109360 Win=1020 Len=0"
"252","7.396679800","10.1.3.206","140.82.114.3","TCP","54","53056  >  443 [ACK] Seq=1630 Ack=110796 Win=1023 Len=0"
"253","7.396716500","10.1.3.206","140.82.114.3","TCP","54","53056  >  443 [ACK] Seq=1630 Ack=112232 Win=1023 Len=0"
"254","7.396741300","10.1.3.206","140.82.114.3","TCP","54","53056  >  443 [ACK] Seq=1630 Ack=113668 Win=1023 Len=0"
"255","7.396773800","10.1.3.206","140.82.114.3","TCP","54","53056  >  443 [ACK] Seq=1630 Ack=115104 Win=1023 Len=0"
"256","7.396806700","10.1.3.206","140.82.114.3","TCP","54","53056  >  443 [ACK] Seq=1630 Ack=116540 Win=1023 Len=0"
"257","7.396839300","10.1.3.206","140.82.114.3","TCP","54","53056  >  443 [ACK] Seq=1630 Ack=117976 Win=1023 Len=0"
"258","7.396870600","10.1.3.206","140.82.114.3","TCP","54","53056  >  443 [ACK] Seq=1630 Ack=119412 Win=1023 Len=0"
"259","7.396904100","10.1.3.206","140.82.114.3","TCP","54","53056  >  443 [ACK] Seq=1630 Ack=120848 Win=1023 Len=0"
"260","7.396924600","10.1.3.206","140.82.114.3","TCP","54","53056  >  443 [ACK] Seq=1630 Ack=122284 Win=1023 Len=0"
"261","7.396941000","10.1.3.206","140.82.114.3","TCP","54","53056  >  443 [ACK] Seq=1630 Ack=123720 Win=1023 Len=0"
"262","7.396962700","10.1.3.206","140.82.114.3","TCP","54","53056  >  443 [ACK] Seq=1630 Ack=125156 Win=1023 Len=0"
"263","7.396976200","10.1.3.206","140.82.114.3","TCP","54","53056  >  443 [ACK] Seq=1630 Ack=126017 Win=1020 Len=0"
"264","7.396989900","10.1.3.206","140.82.114.3","TCP","54","53056  >  443 [ACK] Seq=1630 Ack=127453 Win=1023 Len=0"
"265","7.397003500","10.1.3.206","140.82.114.3","TCP","54","53056  >  443 [ACK] Seq=1630 Ack=128889 Win=1023 Len=0"
"266","7.397024800","10.1.3.206","140.82.114.3","TCP","54","53056  >  443 [ACK] Seq=1630 Ack=130544 Win=1023 Len=0"
"267","7.397045500","10.1.3.206","140.82.114.3","TCP","54","53056  >  443 [ACK] Seq=1630 Ack=130903 Win=1022 Len=0"
"268","7.403704700","10.1.3.206","140.82.114.25","TLSv1.2","395","Application Data"
"269","7.405431600","140.82.114.3","10.1.3.206","TCP","60","443  >  53056 [ACK] Seq=130903 Ack=1630 Win=107 Len=0"
"270","7.406996800","10.1.3.206","140.82.113.6","TLSv1.2","138","Application Data"
"271","7.407085100","10.1.3.206","140.82.113.6","TLSv1.2","93","Application Data"
"272","7.407137700","10.1.3.206","140.82.113.6","TLSv1.2","16460","Application Data"
"273","7.407188800","10.1.3.206","140.82.113.6","TLSv1.2","5399","Application Data"
"274","7.413924600","140.82.114.25","10.1.3.206","TLSv1.2","127","Application Data"
"275","7.415741900","140.82.113.6","10.1.3.206","TCP","60","443  >  49670 [ACK] Seq=1 Ack=124 Win=93 Len=0"
"276","7.415741900","140.82.113.6","10.1.3.206","TLSv1.2","93","Application Data"
"277","7.415741900","140.82.113.6","10.1.3.206","TCP","60","443  >  49670 [ACK] Seq=40 Ack=2996 Win=99 Len=0"
"278","7.415741900","140.82.113.6","10.1.3.206","TCP","60","443  >  49670 [ACK] Seq=40 Ack=5868 Win=105 Len=0"
"279","7.415741900","140.82.113.6","10.1.3.206","TCP","60","443  >  49670 [ACK] Seq=40 Ack=10176 Win=113 Len=0"
"280","7.415741900","140.82.113.6","10.1.3.206","TCP","60","443  >  49670 [ACK] Seq=40 Ack=13048 Win=119 Len=0"
"281","7.415929200","140.82.113.6","10.1.3.206","TCP","60","443  >  49670 [ACK] Seq=40 Ack=16530 Win=125 Len=0"
"282","7.415929200","140.82.113.6","10.1.3.206","TCP","60","443  >  49670 [ACK] Seq=40 Ack=19402 Win=131 Len=0"
"283","7.415929200","140.82.113.6","10.1.3.206","TCP","60","443  >  49670 [ACK] Seq=40 Ack=21875 Win=136 Len=0"
"284","7.416661200","140.82.113.6","10.1.3.206","TLSv1.2","102","Application Data"
"285","7.416827500","10.1.3.206","140.82.113.6","TCP","54","49670  >  443 [ACK] Seq=21875 Ack=88 Win=251 Len=0"
"286","7.447963000","10.1.3.206","140.82.114.25","TLSv1.2","84","Application Data"
"287","7.448140500","10.1.3.206","140.82.114.25","TCP","54","60032  >  443 [FIN, ACK] Seq=372 Ack=74 Win=251 Len=0"
"288","7.448448800","10.1.3.206","23.48.203.115","UDP","71","53187  >  443 Len=29"
"289","7.457028300","23.48.203.115","10.1.3.206","UDP","68","443  >  53187 Len=26"
"290","7.457392100","140.82.114.25","10.1.3.206","TLSv1.2","78","Application Data"
"291","7.457597000","10.1.3.206","140.82.114.25","TCP","54","60032  >  443 [RST, ACK] Seq=373 Ack=98 Win=0 Len=0"
"292","7.457794200","140.82.114.25","10.1.3.206","TCP","60","443  >  60032 [FIN, ACK] Seq=98 Ack=373 Win=79 Len=0"
"293","7.462424700","10.1.3.206","185.199.108.215","UDP","499","52030  >  443 Len=457"
"294","7.463247300","10.1.3.206","185.199.108.215","QUIC","540","Protected Payload (KP0), DCID=3f68d224632aebed0b86259d4cd0cac85a"
"295","7.463499000","10.1.3.206","185.199.108.133","TLSv1.2","147","Application Data"
"296","7.463551500","10.1.3.206","185.199.108.133","TLSv1.2","122","Application Data"
"297","7.463580900","10.1.3.206","185.199.108.133","TLSv1.2","122","Application Data"
"298","7.463609300","10.1.3.206","185.199.108.133","TLSv1.2","122","Application Data"
"299","7.464831600","10.1.3.206","185.199.108.133","TLSv1.2","124","Application Data"
"300","7.464880400","10.1.3.206","185.199.108.133","TLSv1.2","123","Application Data"
"301","7.464908200","10.1.3.206","185.199.108.133","TLSv1.2","123","Application Data"
"302","7.471506400","185.199.108.133","10.1.3.206","TCP","60","443  >  57616 [ACK] Seq=260 Ack=168 Win=282 Len=0"
"303","7.471506400","185.199.108.133","10.1.3.206","TCP","60","443  >  57616 [ACK] Seq=260 Ack=236 Win=282 Len=0"
"304","7.471506400","185.199.108.133","10.1.3.206","TCP","60","443  >  57616 [ACK] Seq=260 Ack=304 Win=282 Len=0"
"305","7.471506400","185.199.108.133","10.1.3.206","TCP","60","443  >  57616 [ACK] Seq=260 Ack=372 Win=282 Len=0"
"306","7.472797000","185.199.108.215","10.1.3.206","QUIC","1322","Protected Payload (KP0)"
"307","7.472797000","185.199.108.215","10.1.3.206","QUIC","1322","Protected Payload (KP0)"
"308","7.472797000","185.199.108.215","10.1.3.206","QUIC","1322","Protected Payload (KP0)"
"309","7.472797000","185.199.108.215","10.1.3.206","QUIC","1197","Protected Payload (KP0)"
"310","7.472797000","185.199.108.133","10.1.3.206","TCP","60","443  >  57616 [ACK] Seq=260 Ack=442 Win=282 Len=0"
"311","7.472797000","185.199.108.133","10.1.3.206","TCP","60","443  >  57616 [ACK] Seq=260 Ack=511 Win=282 Len=0"
"312","7.472797000","185.199.108.133","10.1.3.206","TCP","60","443  >  57616 [ACK] Seq=260 Ack=580 Win=282 Len=0"
"313","7.473318100","10.1.3.206","185.199.108.215","QUIC","82","Protected Payload (KP0), DCID=3f68d224632aebed0b86259d4cd0cac85a"
"314","7.473394800","10.1.3.206","185.199.108.215","QUIC","82","Protected Payload (KP0), DCID=3f68d224632aebed0b86259d4cd0cac85a"
"315","7.473635500","185.199.108.133","10.1.3.206","TCP","1510","443  >  57616 [ACK] Seq=260 Ack=580 Win=282 Len=1456 [TCP PDU reassembled in 316]"
"316","7.473635500","185.199.108.133","10.1.3.206","TLSv1.2","558","Application Data"
"317","7.473635500","185.199.108.133","10.1.3.206","TLSv1.2","238","Application Data"
"318","7.473808200","10.1.3.206","185.199.108.133","TCP","54","57616  >  443 [ACK] Seq=580 Ack=2220 Win=255 Len=0"
"319","7.473844500","185.199.108.133","10.1.3.206","TCP","1510","443  >  57616 [ACK] Seq=2404 Ack=580 Win=282 Len=1456 [TCP PDU reassembled in 320]"
"320","7.473844500","185.199.108.133","10.1.3.206","TLSv1.2","1385","Application Data"
"321","7.473844500","185.199.108.215","10.1.3.206","UDP","1233","443  >  52030 Len=1191"
"322","7.473960500","10.1.3.206","185.199.108.133","TCP","54","57616  >  443 [ACK] Seq=580 Ack=3860 Win=255 Len=0"
"323","7.474073900","185.199.108.133","10.1.3.206","TLSv1.2","369","Application Data"
"324","7.474073900","185.199.108.133","10.1.3.206","TCP","1510","443  >  57616 [ACK] Seq=5506 Ack=580 Win=282 Len=1456 [TCP PDU reassembled in 328]"
"325","7.474073900","185.199.108.133","10.1.3.206","TCP","1510","443  >  57616 [ACK] Seq=6962 Ack=580 Win=282 Len=1456 [TCP PDU reassembled in 328]"
"326","7.474073900","185.199.108.133","10.1.3.206","TCP","1510","443  >  57616 [ACK] Seq=8418 Ack=580 Win=282 Len=1456 [TCP PDU reassembled in 328]"
"327","7.474073900","185.199.108.133","10.1.3.206","TCP","1510","443  >  57616 [ACK] Seq=9874 Ack=580 Win=282 Len=1456 [TCP PDU reassembled in 328]"
"328","7.474073900","185.199.108.133","10.1.3.206","TLSv1.2","1334","Application Data"
"329","7.474209400","10.1.3.206","185.199.108.133","TCP","54","57616  >  443 [ACK] Seq=580 Ack=5506 Win=255 Len=0"
"330","7.474242500","10.1.3.206","185.199.108.133","TCP","54","57616  >  443 [ACK] Seq=580 Ack=8418 Win=255 Len=0"
"331","7.474267800","10.1.3.206","185.199.108.133","TCP","54","57616  >  443 [ACK] Seq=580 Ack=11330 Win=255 Len=0"
"332","7.474385300","185.199.108.133","10.1.3.206","TLSv1.2","498","Application Data"
"333","7.474385300","185.199.108.133","10.1.3.206","TCP","1510","443  >  57616 [ACK] Seq=13054 Ack=580 Win=282 Len=1456 [TCP PDU reassembled in 334]"
"334","7.474385300","185.199.108.133","10.1.3.206","TLSv1.2","957","Application Data"
"335","7.474385300","185.199.108.133","10.1.3.206","TCP","1510","443  >  57616 [ACK] Seq=15413 Ack=580 Win=282 Len=1456 [TCP PDU reassembled in 337]"
"336","7.474385300","185.199.108.133","10.1.3.206","TCP","1510","443  >  57616 [ACK] Seq=16869 Ack=580 Win=282 Len=1456 [TCP PDU reassembled in 337]"
"337","7.474385300","185.199.108.133","10.1.3.206","TLSv1.2","373","Application Data"
"338","7.474500000","10.1.3.206","185.199.108.133","TCP","54","57616  >  443 [ACK] Seq=580 Ack=13054 Win=255 Len=0"
"339","7.474528500","10.1.3.206","185.199.108.133","TCP","54","57616  >  443 [ACK] Seq=580 Ack=15413 Win=255 Len=0"
"340","7.474556400","10.1.3.206","185.199.108.133","TCP","54","57616  >  443 [ACK] Seq=580 Ack=18325 Win=255 Len=0"
"341","7.474692300","185.199.108.133","10.1.3.206","TCP","1510","443  >  57616 [ACK] Seq=18644 Ack=580 Win=282 Len=1456 [TCP PDU reassembled in 351]"
"342","7.474692300","185.199.108.133","10.1.3.206","TCP","1510","443  >  57616 [ACK] Seq=20100 Ack=580 Win=282 Len=1456 [TCP PDU reassembled in 351]"
"343","7.474692300","185.199.108.133","10.1.3.206","TCP","1510","443  >  57616 [ACK] Seq=21556 Ack=580 Win=282 Len=1456 [TCP PDU reassembled in 351]"
"344","7.474692300","185.199.108.133","10.1.3.206","TCP","1510","443  >  57616 [ACK] Seq=23012 Ack=580 Win=282 Len=1456 [TCP PDU reassembled in 351]"
"345","7.474692300","185.199.108.133","10.1.3.206","TCP","1510","443  >  57616 [ACK] Seq=24468 Ack=580 Win=282 Len=1456 [TCP PDU reassembled in 351]"
"346","7.474692300","185.199.108.133","10.1.3.206","TCP","1510","443  >  57616 [ACK] Seq=25924 Ack=580 Win=282 Len=1456 [TCP PDU reassembled in 351]"
"347","7.474692300","185.199.108.133","10.1.3.206","TCP","1510","443  >  57616 [ACK] Seq=27380 Ack=580 Win=282 Len=1456 [TCP PDU reassembled in 351]"
"348","7.474692300","185.199.108.133","10.1.3.206","TCP","1510","443  >  57616 [ACK] Seq=28836 Ack=580 Win=282 Len=1456 [TCP PDU reassembled in 351]"
"349","7.474692300","185.199.108.133","10.1.3.206","TCP","1510","443  >  57616 [ACK] Seq=30292 Ack=580 Win=282 Len=1456 [TCP PDU reassembled in 351]"
"350","7.474692300","185.199.108.133","10.1.3.206","TCP","1510","443  >  57616 [ACK] Seq=31748 Ack=580 Win=282 Len=1456 [TCP PDU reassembled in 351]"
"351","7.474692300","185.199.108.133","10.1.3.206","TLSv1.2","491","Application Data"
"352","7.474915900","10.1.3.206","185.199.108.133","TCP","54","57616  >  443 [ACK] Seq=580 Ack=20100 Win=255 Len=0"
"353","7.474946500","10.1.3.206","185.199.108.133","TCP","54","57616  >  443 [ACK] Seq=580 Ack=23012 Win=255 Len=0"
"354","7.474970000","10.1.3.206","185.199.108.133","TCP","54","57616  >  443 [ACK] Seq=580 Ack=25924 Win=255 Len=0"
"355","7.474993100","10.1.3.206","185.199.108.133","TCP","54","57616  >  443 [ACK] Seq=580 Ack=28836 Win=255 Len=0"
"356","7.475020300","10.1.3.206","185.199.108.133","TCP","54","57616  >  443 [ACK] Seq=580 Ack=31748 Win=255 Len=0"
"357","7.475046300","10.1.3.206","185.199.108.133","TCP","54","57616  >  443 [ACK] Seq=580 Ack=33641 Win=255 Len=0"
"358","7.475482200","185.199.108.133","10.1.3.206","TCP","1510","443  >  57616 [ACK] Seq=33641 Ack=580 Win=282 Len=1456 [TCP PDU reassembled in 360]"
"359","7.475482200","185.199.108.133","10.1.3.206","TCP","1510","443  >  57616 [ACK] Seq=35097 Ack=580 Win=282 Len=1456 [TCP PDU reassembled in 360]"
"360","7.475482200","185.199.108.133","10.1.3.206","TLSv1.2","1425","Application Data"
"361","7.475578100","10.1.3.206","185.199.108.133","TCP","54","57616  >  443 [ACK] Seq=580 Ack=36553 Win=255 Len=0"
"362","7.476587400","10.1.3.206","185.199.108.215","UDP","84","52030  >  443 Len=42"
"363","7.477222800","140.82.113.6","10.1.3.206","TLSv1.2","1025","Application Data"
"364","7.482218100","10.1.3.206","4.153.72.49","TCP","54","52633  >  443 [FIN, ACK] Seq=1 Ack=26 Win=255 Len=0"
"365","7.482254700","10.1.3.206","4.153.72.49","TCP","54","52633  >  443 [RST, ACK] Seq=2 Ack=26 Win=0 Len=0"
"366","7.482353700","10.1.3.206","23.48.203.115","TCP","54","60940  >  443 [FIN, ACK] Seq=1 Ack=1 Win=253 Len=0"
"367","7.482580500","10.1.3.206","185.199.108.133","TLSv1.2","226","Application Data"
"368","7.488191800","10.1.3.206","185.199.108.133","TLSv1.2","89","Application Data"
"369","7.490547100","185.199.108.133","10.1.3.206","TCP","60","443  >  57616 [ACK] Seq=37924 Ack=752 Win=282 Len=0"
"370","7.490547100","23.48.203.115","10.1.3.206","TCP","60","443  >  60940 [ACK] Seq=1 Ack=2 Win=501 Len=0"
"371","7.492587100","185.199.108.133","10.1.3.206","TCP","1510","443  >  57616 [ACK] Seq=37924 Ack=752 Win=282 Len=1456 [TCP PDU reassembled in 381]"
"372","7.492587100","185.199.108.133","10.1.3.206","TCP","1510","443  >  57616 [ACK] Seq=39380 Ack=752 Win=282 Len=1456 [TCP PDU reassembled in 381]"
"373","7.492587100","185.199.108.133","10.1.3.206","TCP","1510","443  >  57616 [ACK] Seq=40836 Ack=752 Win=282 Len=1456 [TCP PDU reassembled in 381]"
"374","7.492587100","185.199.108.133","10.1.3.206","TCP","1510","443  >  57616 [ACK] Seq=42292 Ack=752 Win=282 Len=1456 [TCP PDU reassembled in 381]"
"375","7.492587100","185.199.108.133","10.1.3.206","TCP","1510","443  >  57616 [ACK] Seq=43748 Ack=752 Win=282 Len=1456 [TCP PDU reassembled in 381]"
"376","7.492587100","185.199.108.133","10.1.3.206","TCP","1510","443  >  57616 [ACK] Seq=45204 Ack=752 Win=282 Len=1456 [TCP PDU reassembled in 381]"
"377","7.492587100","185.199.108.133","10.1.3.206","TCP","1510","443  >  57616 [ACK] Seq=46660 Ack=752 Win=282 Len=1456 [TCP PDU reassembled in 381]"
"378","7.492587100","185.199.108.133","10.1.3.206","TCP","1510","443  >  57616 [ACK] Seq=48116 Ack=752 Win=282 Len=1456 [TCP PDU reassembled in 381]"
"379","7.492587100","185.199.108.133","10.1.3.206","TCP","1510","443  >  57616 [ACK] Seq=49572 Ack=752 Win=282 Len=1456 [TCP PDU reassembled in 381]"
"380","7.492587100","185.199.108.133","10.1.3.206","TCP","1510","443  >  57616 [ACK] Seq=51028 Ack=752 Win=282 Len=1456 [TCP PDU reassembled in 381]"
"381","7.492587100","185.199.108.133","10.1.3.206","TLSv1.2","526","Application Data"
"382","7.492940900","10.1.3.206","185.199.108.133","TCP","54","57616  >  443 [ACK] Seq=787 Ack=39380 Win=255 Len=0"
"383","7.493028500","10.1.3.206","185.199.108.133","TCP","54","57616  >  443 [ACK] Seq=787 Ack=40836 Win=250 Len=0"
"384","7.493062100","10.1.3.206","185.199.108.133","TCP","54","57616  >  443 [ACK] Seq=787 Ack=42292 Win=255 Len=0"
"385","7.493084600","10.1.3.206","185.199.108.133","TCP","54","57616  >  443 [ACK] Seq=787 Ack=43748 Win=250 Len=0"
"386","7.493106100","10.1.3.206","185.199.108.133","TCP","54","57616  >  443 [ACK] Seq=787 Ack=45204 Win=255 Len=0"
