"No.","Time","Source","Destination","Protocol","Length","Info"
"1","0.000000000","162.247.243.29","10.1.26.108","TLSv1.2","94","Application Data"
"2","0.020671000","162.247.243.29","10.1.26.108","TLSv1.2","94","Application Data"
"3","0.038987200","162.247.243.29","10.1.26.108","TLSv1.2","94","Application Data"
"4","0.048160600","162.247.243.29","10.1.26.108","TLSv1.2","94","Application Data"
"5","0.415775900","10.1.3.206","13.89.178.26","TLSv1.2","137","Application Data"
"6","0.415845500","10.1.3.206","13.89.178.26","TLSv1.2","906","Application Data"
"7","0.455437900","13.89.178.26","10.1.3.206","TCP","60","443  >  55448 [ACK] Seq=1 Ack=936 Win=16385 Len=0"
"8","0.457263600","13.89.178.26","10.1.3.206","TLSv1.2","154","Application Data"
"9","0.458001800","10.1.3.206","13.89.178.26","TLSv1.2","89","Application Data"
"10","0.584028800","34.111.80.193","10.1.42.225","TLSv1.2","143","Application Data"
"11","0.591701700","13.89.178.26","10.1.3.206","TCP","60","443  >  55448 [ACK] Seq=101 Ack=971 Win=16384 Len=0"
"12","1.337106300","57.144.50.144","10.3.14.153","TLSv1.2","94","Application Data"
"13","2.865692100","162.247.243.29","10.2.37.140","TLSv1.2","94","Application Data"
"14","2.865692100","162.247.243.29","10.2.37.140","TCP","70","443  >  52956 [FIN, ACK] Seq=25 Ack=1 Win=283 Len=0 TSval=1002884916 TSecr=3129309956"
"15","2.866360500","162.247.243.29","10.2.37.140","TLSv1.2","94","Application Data"
"16","2.866360500","162.247.243.29","10.2.37.140","TCP","70","443  >  52957 [FIN, ACK] Seq=25 Ack=1 Win=277 Len=0 TSval=3379837716 TSecr=4233411671"
"17","2.893738400","162.247.243.29","10.2.37.140","TCP","70","[TCP Retransmission] 443  >  52957 [FIN, ACK] Seq=25 Ack=1 Win=277 Len=0 TSval=3379837744 TSecr=4233411671"
"18","2.893738400","162.247.243.29","10.2.37.140","TCP","70","[TCP Retransmission] 443  >  52956 [FIN, ACK] Seq=25 Ack=1 Win=283 Len=0 TSval=1002884945 TSecr=3129309956"
"19","3.112764500","162.247.243.29","10.2.37.140","TCP","94","[TCP Retransmission] 443  >  52957 [FIN, PSH, ACK] Seq=1 Ack=1 Win=277 Len=24 TSval=3379837963 TSecr=4233411671"
"20","3.112764500","162.247.243.29","10.2.37.140","TCP","94","[TCP Retransmission] 443  >  52956 [FIN, PSH, ACK] Seq=1 Ack=1 Win=283 Len=24 TSval=1002885164 TSecr=3129309956"
"21","3.456225800","162.247.243.29","10.1.26.108","TCP","94","[TCP Retransmission] 443  >  53248 [FIN, PSH, ACK] Seq=1 Ack=1 Win=277 Len=24 TSval=4158284411 TSecr=545591320"
"22","3.475623200","162.247.243.29","10.1.26.108","TCP","94","[TCP Retransmission] 443  >  53246 [FIN, PSH, ACK] Seq=1 Ack=1 Win=277 Len=24 TSval=1338036555 TSecr=2572533625"
"23","3.495011900","162.247.243.29","10.1.26.108","TCP","94","[TCP Retransmission] 443  >  53247 [FIN, PSH, ACK] Seq=1 Ack=1 Win=277 Len=24 TSval=3078175094 TSecr=4022171496"
"24","3.504253200","162.247.243.29","10.1.26.108","TCP","94","[TCP Retransmission] 443  >  53249 [FIN, PSH, ACK] Seq=1 Ack=1 Win=278 Len=24 TSval=2826082602 TSecr=2890953363"
"25","3.543892500","162.247.243.29","10.2.37.140","TCP","94","[TCP Retransmission] 443  >  52957 [FIN, PSH, ACK] Seq=1 Ack=1 Win=277 Len=24 TSval=3379838394 TSecr=4233411671"
"26","3.544939200","162.247.243.29","10.2.37.140","TCP","94","[TCP Retransmission] 443  >  52956 [FIN, PSH, ACK] Seq=1 Ack=1 Win=283 Len=24 TSval=1002885596 TSecr=3129309956"
"27","3.549789400","10.1.3.206","20.230.171.39","TLSv1.2","4512","Application Data"
"28","3.549853100","10.1.3.206","20.230.171.39","TLSv1.2","1632","Application Data"
"29","3.550272000","10.1.3.206","23.39.184.192","TLSv1.2","7149","Application Data"
"30","3.550334100","10.1.3.206","23.39.184.192","TLSv1.2","93","Application Data"
"31","3.559674300","23.39.184.192","10.1.3.206","TCP","60","443  >  58444 [ACK] Seq=1 Ack=1461 Win=673 Len=0"
"32","3.559674300","23.39.184.192","10.1.3.206","TCP","60","443  >  58444 [ACK] Seq=1 Ack=7096 Win=644 Len=0"
"33","3.559674300","23.39.184.192","10.1.3.206","TCP","60","443  >  58444 [ACK] Seq=1 Ack=7135 Win=644 Len=0"
"34","3.560158000","23.39.184.192","10.1.3.206","TLSv1.2","93","Application Data"
"35","3.611549400","23.39.184.192","10.1.3.206","TLSv1.2","423","Application Data"
"36","3.611645200","10.1.3.206","23.39.184.192","TCP","54","58444  >  443 [ACK] Seq=7135 Ack=409 Win=510 Len=0"
"37","3.633286500","20.230.171.39","10.1.3.206","TCP","60","443  >  60087 [ACK] Seq=1 Ack=2921 Win=554 Len=0"
"38","3.633286500","20.230.171.39","10.1.3.206","TCP","60","443  >  60087 [ACK] Seq=1 Ack=4459 Win=554 Len=0"
"39","3.633580300","20.230.171.39","10.1.3.206","TCP","60","443  >  60087 [ACK] Seq=1 Ack=6037 Win=554 Len=0"
"40","3.645481300","20.230.171.39","10.1.3.206","TLSv1.2","1425","Application Data"
"41","3.698482700","10.1.3.206","20.230.171.39","TCP","54","60087  >  443 [ACK] Seq=6037 Ack=1372 Win=250 Len=0"
"42","3.880290700","10.1.3.206","23.207.139.66","TCP","66","49393  >  443 [SYN] Seq=0 Win=65535 Len=0 MSS=1460 WS=256 SACK_PERM"
"43","3.888649200","23.207.139.66","10.1.3.206","TCP","66","443  >  49393 [SYN, ACK] Seq=0 Ack=1 Win=64240 Len=0 MSS=1460 SACK_PERM WS=128"
"44","3.888736500","10.1.3.206","23.207.139.66","TCP","54","49393  >  443 [ACK] Seq=1 Ack=1 Win=65280 Len=0"
"45","3.889183800","10.1.3.206","23.207.139.66","TLSv1.2","2076","Client Hello (SNI=b.wal.co)"
"46","3.897483500","23.207.139.66","10.1.3.206","TCP","60","443  >  49393 [ACK] Seq=1 Ack=2023 Win=68224 Len=0"
"47","3.897684400","23.207.139.66","10.1.3.206","TLSv1.2","204","Server Hello, Change Cipher Spec, Encrypted Handshake Message"
"48","3.899120700","10.1.3.206","23.207.139.66","TLSv1.2","105","Change Cipher Spec, Encrypted Handshake Message"
"49","3.907275000","23.207.139.66","10.1.3.206","TCP","60","443  >  49393 [ACK] Seq=151 Ack=2074 Win=68224 Len=0"
"50","4.407856200","162.247.243.29","10.2.37.140","TCP","94","[TCP Retransmission] 443  >  52957 [FIN, PSH, ACK] Seq=1 Ack=1 Win=277 Len=24 TSval=3379839258 TSecr=4233411671"
"51","4.440908100","162.247.243.29","10.2.37.140","TCP","94","[TCP Retransmission] 443  >  52956 [FIN, PSH, ACK] Seq=1 Ack=1 Win=283 Len=24 TSval=1002886492 TSecr=3129309956"
"52","5.543362800","10.1.3.206","13.89.178.26","TLSv1.2","138","Application Data"
"53","5.543427300","10.1.3.206","13.89.178.26","TLSv1.2","1545","Application Data"
"54","5.583114600","13.89.178.26","10.1.3.206","TCP","60","443  >  55448 [ACK] Seq=101 Ack=2546 Win=16385 Len=0"
"55","5.593554000","13.89.178.26","10.1.3.206","TLSv1.2","154","Application Data"
"56","5.594433000","10.1.3.206","13.89.178.26","TLSv1.2","89","Application Data"
"57","5.779091800","13.89.178.26","10.1.3.206","TCP","60","443  >  55448 [ACK] Seq=201 Ack=2581 Win=16384 Len=0"
"58","5.918400900","23.39.184.192","10.1.3.206","TCP","1514","443  >  58444 [ACK] Seq=409 Ack=7135 Win=673 Len=1460 [TCP PDU reassembled in 62]"
"59","5.918400900","23.39.184.192","10.1.3.206","TCP","1514","443  >  58444 [ACK] Seq=1869 Ack=7135 Win=673 Len=1460 [TCP PDU reassembled in 62]"
"60","5.918400900","23.39.184.192","10.1.3.206","TCP","1514","443  >  58444 [ACK] Seq=3329 Ack=7135 Win=673 Len=1460 [TCP PDU reassembled in 62]"
"61","5.918400900","23.39.184.192","10.1.3.206","TCP","1514","443  >  58444 [ACK] Seq=4789 Ack=7135 Win=673 Len=1460 [TCP PDU reassembled in 62]"
"62","5.918400900","23.39.184.192","10.1.3.206","TLSv1.2","532","Application Data"
"63","5.918581000","10.1.3.206","23.39.184.192","TCP","54","58444  >  443 [ACK] Seq=7135 Ack=3329 Win=511 Len=0"
"64","5.918620300","10.1.3.206","23.39.184.192","TCP","54","58444  >  443 [ACK] Seq=7135 Ack=6249 Win=511 Len=0"
"65","5.918679100","23.39.184.192","10.1.3.206","TCP","1514","443  >  58444 [ACK] Seq=6727 Ack=7135 Win=673 Len=1460 [TCP PDU reassembled in 79]"
"66","5.918679100","23.39.184.192","10.1.3.206","TCP","1514","443  >  58444 [ACK] Seq=8187 Ack=7135 Win=673 Len=1460 [TCP PDU reassembled in 79]"
"67","5.918679100","23.39.184.192","10.1.3.206","TCP","1514","443  >  58444 [ACK] Seq=9647 Ack=7135 Win=673 Len=1460 [TCP PDU reassembled in 79]"
"68","5.918679100","23.39.184.192","10.1.3.206","TCP","1514","443  >  58444 [ACK] Seq=11107 Ack=7135 Win=673 Len=1460 [TCP PDU reassembled in 79]"
"69","5.918679100","23.39.184.192","10.1.3.206","TCP","1514","443  >  58444 [ACK] Seq=12567 Ack=7135 Win=673 Len=1460 [TCP PDU reassembled in 79]"
"70","5.918679100","23.39.184.192","10.1.3.206","TCP","1514","443  >  58444 [PSH, ACK] Seq=14027 Ack=7135 Win=673 Len=1460 [TCP PDU reassembled in 79]"
"71","5.918916600","10.1.3.206","23.39.184.192","TCP","54","58444  >  443 [ACK] Seq=7135 Ack=8187 Win=511 Len=0"
"72","5.918947800","10.1.3.206","23.39.184.192","TCP","54","58444  >  443 [ACK] Seq=7135 Ack=11107 Win=511 Len=0"
"73","5.918968000","10.1.3.206","23.39.184.192","TCP","54","58444  >  443 [ACK] Seq=7135 Ack=14027 Win=511 Len=0"
"74","5.919528400","23.39.184.192","10.1.3.206","TCP","1514","443  >  58444 [ACK] Seq=15487 Ack=7135 Win=673 Len=1460 [TCP PDU reassembled in 79]"
"75","5.919528400","23.39.184.192","10.1.3.206","TCP","1514","443  >  58444 [ACK] Seq=16947 Ack=7135 Win=673 Len=1460 [TCP PDU reassembled in 79]"
"76","5.919528400","23.39.184.192","10.1.3.206","TCP","1514","443  >  58444 [ACK] Seq=18407 Ack=7135 Win=673 Len=1460 [TCP PDU reassembled in 79]"
"77","5.919528400","23.39.184.192","10.1.3.206","TCP","1514","443  >  58444 [ACK] Seq=19867 Ack=7135 Win=673 Len=1460 [TCP PDU reassembled in 79]"
"78","5.919528400","23.39.184.192","10.1.3.206","TCP","1514","443  >  58444 [ACK] Seq=21327 Ack=7135 Win=673 Len=1460 [TCP PDU reassembled in 79]"
"79","5.919528400","23.39.184.192","10.1.3.206","TLSv1.2","400","Application Data"
"80","5.919728000","10.1.3.206","23.39.184.192","TCP","54","58444  >  443 [ACK] Seq=7135 Ack=16947 Win=511 Len=0"
"81","5.919809600","10.1.3.206","23.39.184.192","TCP","54","58444  >  443 [ACK] Seq=7135 Ack=19867 Win=511 Len=0"
"82","5.919841100","10.1.3.206","23.39.184.192","TCP","54","58444  >  443 [ACK] Seq=7135 Ack=22787 Win=511 Len=0"
"83","5.920283600","23.39.184.192","10.1.3.206","TLSv1.2","1514","Application Data"
"84","5.920283600","23.39.184.192","10.1.3.206","TCP","1514","443  >  58444 [ACK] Seq=24593 Ack=7135 Win=673 Len=1460 [TCP PDU reassembled in 97]"
"85","5.920283600","23.39.184.192","10.1.3.206","TCP","1514","443  >  58444 [ACK] Seq=26053 Ack=7135 Win=673 Len=1460 [TCP PDU reassembled in 97]"
"86","5.920283600","23.39.184.192","10.1.3.206","TCP","1514","443  >  58444 [ACK] Seq=27513 Ack=7135 Win=673 Len=1460 [TCP PDU reassembled in 97]"
"87","5.920283600","23.39.184.192","10.1.3.206","TCP","1514","443  >  58444 [ACK] Seq=28973 Ack=7135 Win=673 Len=1460 [TCP PDU reassembled in 97]"
"88","5.920283600","23.39.184.192","10.1.3.206","TCP","1514","443  >  58444 [PSH, ACK] Seq=30433 Ack=7135 Win=673 Len=1460 [TCP PDU reassembled in 97]"
"89","5.920443600","10.1.3.206","23.39.184.192","TCP","54","58444  >  443 [ACK] Seq=7135 Ack=24593 Win=511 Len=0"
"90","5.920506000","10.1.3.206","23.39.184.192","TCP","54","58444  >  443 [ACK] Seq=7135 Ack=27513 Win=511 Len=0"
"91","5.920542600","10.1.3.206","23.39.184.192","TCP","54","58444  >  443 [ACK] Seq=7135 Ack=30433 Win=511 Len=0"
"92","5.921155600","23.39.184.192","10.1.3.206","TCP","1514","443  >  58444 [ACK] Seq=31893 Ack=7135 Win=673 Len=1460 [TCP PDU reassembled in 97]"
"93","5.921155600","23.39.184.192","10.1.3.206","TCP","1514","443  >  58444 [ACK] Seq=33353 Ack=7135 Win=673 Len=1460 [TCP PDU reassembled in 97]"
"94","5.921155600","23.39.184.192","10.1.3.206","TCP","1514","443  >  58444 [ACK] Seq=34813 Ack=7135 Win=673 Len=1460 [TCP PDU reassembled in 97]"
"95","5.921155600","23.39.184.192","10.1.3.206","TCP","1514","443  >  58444 [ACK] Seq=36273 Ack=7135 Win=673 Len=1460 [TCP PDU reassembled in 97]"
"96","5.921155600","23.39.184.192","10.1.3.206","TCP","1514","443  >  58444 [ACK] Seq=37733 Ack=7135 Win=673 Len=1460 [TCP PDU reassembled in 97]"
"97","5.921155600","23.39.184.192","10.1.3.206","TLSv1.2","1514","Application Data, Application Data"
"98","5.921260100","10.1.3.206","23.39.184.192","TCP","54","58444  >  443 [ACK] Seq=7135 Ack=33353 Win=511 Len=0"
"99","5.921306200","10.1.3.206","23.39.184.192","TCP","54","58444  >  443 [ACK] Seq=7135 Ack=36273 Win=511 Len=0"
"100","5.921352300","10.1.3.206","23.39.184.192","TCP","54","58444  >  443 [ACK] Seq=7135 Ack=39193 Win=511 Len=0"
"101","5.922013300","10.1.3.206","23.39.184.192","TLSv1.2","89","Application Data"
"102","5.922029200","23.39.184.192","10.1.3.206","TCP","1514","443  >  58444 [ACK] Seq=40653 Ack=7135 Win=673 Len=1460 [TCP PDU reassembled in 106]"
"103","5.922029200","23.39.184.192","10.1.3.206","TCP","1514","443  >  58444 [ACK] Seq=42113 Ack=7135 Win=673 Len=1460 [TCP PDU reassembled in 106]"
"104","5.922029200","23.39.184.192","10.1.3.206","TCP","1514","443  >  58444 [ACK] Seq=43573 Ack=7135 Win=673 Len=1460 [TCP PDU reassembled in 106]"
"105","5.922029200","23.39.184.192","10.1.3.206","TCP","1514","443  >  58444 [ACK] Seq=45033 Ack=7135 Win=673 Len=1460 [TCP PDU reassembled in 106]"
"106","5.922029200","23.39.184.192","10.1.3.206","TLSv1.2","1375","Application Data"
"107","5.922184300","10.1.3.206","23.39.184.192","TCP","54","58444  >  443 [ACK] Seq=7170 Ack=42113 Win=511 Len=0"
"108","5.922234900","10.1.3.206","23.39.184.192","TCP","54","58444  >  443 [ACK] Seq=7170 Ack=43573 Win=511 Len=0"
"109","5.922267100","10.1.3.206","23.39.184.192","TCP","54","58444  >  443 [ACK] Seq=7170 Ack=45033 Win=511 Len=0"
"110","5.922290200","10.1.3.206","23.39.184.192","TCP","54","58444  >  443 [ACK] Seq=7170 Ack=46493 Win=511 Len=0"
"111","5.930330200","23.39.184.192","10.1.3.206","TCP","60","443  >  58444 [ACK] Seq=47814 Ack=7170 Win=673 Len=0"
"112","5.934727200","10.1.3.206","34.120.250.63","QUIC","1292","Initial, DCID=e251c7bb04693a95, PKN: 1, PING, PING, PING, PADDING, PING, PADDING, CRYPTO, PING, CRYPTO, PADDING, CRYPTO, PING, CRYPTO, CRYPTO, PING, CRYPTO, PADDING, PING, PADDING, PING, PING"
"113","5.934866000","10.1.3.206","34.120.250.63","QUIC","1292","Initial, DCID=e251c7bb04693a95, PKN: 2, PING, CRYPTO, CRYPTO, CRYPTO, CRYPTO, PING, PING, PADDING, PING, PADDING, CRYPTO, CRYPTO, CRYPTO, CRYPTO, PADDING, CRYPTO, PING"
"114","5.943747100","34.120.250.63","10.1.3.206","QUIC","82","Initial, SCID=e251c7bb04693a95, PKN: 1, ACK"
"115","5.944114600","34.120.250.63","10.1.3.206","QUIC","1292","Initial, SCID=e251c7bb04693a95, PKN: 2, ACK, PADDING"
"116","5.946046000","34.120.250.63","10.1.3.206","QUIC","1292","Protected Payload (KP0)"
"117","5.946506400","10.1.3.206","34.120.250.63","QUIC","205","Protected Payload (KP0), DCID=e251c7bb04693a95"
"118","5.946883100","10.1.3.206","34.120.250.63","QUIC","531","Protected Payload (KP0), DCID=e251c7bb04693a95"
"119","5.946979600","10.1.3.206","34.120.250.63","QUIC","1288","Protected Payload (KP0), DCID=e251c7bb04693a95"
"120","5.947021600","10.1.3.206","34.120.250.63","QUIC","152","Protected Payload (KP0), DCID=e251c7bb04693a95"
"121","5.948134900","23.39.184.192","10.1.3.206","TCP","1514","443  >  58444 [ACK] Seq=47814 Ack=7170 Win=673 Len=1460 [TCP PDU reassembled in 127]"
"122","5.948134900","23.39.184.192","10.1.3.206","TCP","1514","443  >  58444 [ACK] Seq=49274 Ack=7170 Win=673 Len=1460 [TCP PDU reassembled in 127]"
"123","5.948134900","23.39.184.192","10.1.3.206","TCP","1514","443  >  58444 [ACK] Seq=50734 Ack=7170 Win=673 Len=1460 [TCP PDU reassembled in 127]"
"124","5.948134900","23.39.184.192","10.1.3.206","TCP","1514","443  >  58444 [ACK] Seq=52194 Ack=7170 Win=673 Len=1460 [TCP PDU reassembled in 127]"
"125","5.948134900","23.39.184.192","10.1.3.206","TCP","1514","443  >  58444 [ACK] Seq=53654 Ack=7170 Win=673 Len=1460 [TCP PDU reassembled in 127]"
"126","5.948134900","23.39.184.192","10.1.3.206","TCP","1514","443  >  58444 [ACK] Seq=55114 Ack=7170 Win=673 Len=1460 [TCP PDU reassembled in 127]"
"127","5.948134900","23.39.184.192","10.1.3.206","TLSv1.2","531","Application Data"
"128","5.948304100","10.1.3.206","23.39.184.192","TCP","54","58444  >  443 [ACK] Seq=7170 Ack=49274 Win=511 Len=0"
"129","5.948371500","10.1.3.206","23.39.184.192","TCP","54","58444  >  443 [ACK] Seq=7170 Ack=52194 Win=511 Len=0"
"130","5.948401400","10.1.3.206","23.39.184.192","TCP","54","58444  >  443 [ACK] Seq=7170 Ack=55114 Win=511 Len=0"
"131","5.948430200","10.1.3.206","23.39.184.192","TCP","54","58444  >  443 [ACK] Seq=7170 Ack=57051 Win=511 Len=0"
"132","5.955459500","34.120.250.63","10.1.3.206","QUIC","626","Protected Payload (KP0)"
"133","5.955459500","34.120.250.63","10.1.3.206","QUIC","163","Protected Payload (KP0)"
"134","5.955796000","10.1.3.206","34.120.250.63","QUIC","73","Protected Payload (KP0), DCID=e251c7bb04693a95"
"135","5.955900400","34.120.250.63","10.1.3.206","QUIC","69","Protected Payload (KP0)"
"136","5.955900400","34.120.250.63","10.1.3.206","QUIC","65","Protected Payload (KP0)"
"137","5.975331700","10.1.3.206","23.48.203.111","UDP","71","54583  >  443 Len=29"
"138","5.984048000","10.1.3.206","34.120.250.63","QUIC","74","Protected Payload (KP0), DCID=e251c7bb04693a95"
"139","5.997837300","23.39.184.192","10.1.3.206","TLSv1.2","175","Application Data"
"140","5.998065400","23.39.184.192","10.1.3.206","TCP","1514","443  >  58444 [ACK] Seq=57172 Ack=7170 Win=673 Len=1460 [TCP PDU reassembled in 155]"
"141","5.998065400","23.39.184.192","10.1.3.206","TCP","1514","443  >  58444 [ACK] Seq=58632 Ack=7170 Win=673 Len=1460 [TCP PDU reassembled in 155]"
"142","5.998065400","23.39.184.192","10.1.3.206","TCP","1514","443  >  58444 [ACK] Seq=60092 Ack=7170 Win=673 Len=1460 [TCP PDU reassembled in 155]"
"143","5.998065400","23.39.184.192","10.1.3.206","TCP","1514","443  >  58444 [ACK] Seq=61552 Ack=7170 Win=673 Len=1460 [TCP PDU reassembled in 155]"
"144","5.998065400","23.39.184.192","10.1.3.206","TCP","1514","443  >  58444 [ACK] Seq=63012 Ack=7170 Win=673 Len=1460 [TCP PDU reassembled in 155]"
"145","5.998065400","23.39.184.192","10.1.3.206","TCP","1514","443  >  58444 [ACK] Seq=64472 Ack=7170 Win=673 Len=1460 [TCP PDU reassembled in 155]"
"146","5.998065400","23.39.184.192","10.1.3.206","TCP","1514","443  >  58444 [PSH, ACK] Seq=65932 Ack=7170 Win=673 Len=1460 [TCP PDU reassembled in 155]"
"147","5.998361600","10.1.3.206","23.39.184.192","TCP","54","58444  >  443 [ACK] Seq=7170 Ack=58632 Win=511 Len=0"
"148","5.998483500","10.1.3.206","23.39.184.192","TCP","54","58444  >  443 [ACK] Seq=7170 Ack=61552 Win=511 Len=0"
"149","5.998533400","10.1.3.206","23.39.184.192","TCP","54","58444  >  443 [ACK] Seq=7170 Ack=64472 Win=511 Len=0"
"150","5.998578200","10.1.3.206","23.39.184.192","TCP","54","58444  >  443 [ACK] Seq=7170 Ack=67392 Win=511 Len=0"
"151","5.998745100","23.39.184.192","10.1.3.206","TCP","1514","443  >  58444 [ACK] Seq=67392 Ack=7170 Win=673 Len=1460 [TCP PDU reassembled in 155]"
"152","5.998745100","23.39.184.192","10.1.3.206","TCP","1514","443  >  58444 [ACK] Seq=68852 Ack=7170 Win=673 Len=1460 [TCP PDU reassembled in 155]"
"153","5.998745100","23.39.184.192","10.1.3.206","TCP","1514","443  >  58444 [ACK] Seq=70312 Ack=7170 Win=673 Len=1460 [TCP PDU reassembled in 155]"
"154","5.998745100","23.39.184.192","10.1.3.206","TCP","1514","443  >  58444 [ACK] Seq=71772 Ack=7170 Win=673 Len=1460 [TCP PDU reassembled in 155]"
"155","5.998745100","23.39.184.192","10.1.3.206","TLSv1.2","400","Application Data"
"156","5.998975000","10.1.3.206","23.39.184.192","TCP","54","58444  >  443 [ACK] Seq=7170 Ack=70312 Win=511 Len=0"
"157","5.999101200","10.1.3.206","23.39.184.192","TCP","54","58444  >  443 [ACK] Seq=7170 Ack=73232 Win=511 Len=0"
"158","5.999292500","23.39.184.192","10.1.3.206","TLSv1.2","1514","Application Data"
"159","5.999292500","23.39.184.192","10.1.3.206","TCP","1514","443  >  58444 [ACK] Seq=75038 Ack=7170 Win=673 Len=1460 [TCP PDU reassembled in 173]"
"160","5.999292500","23.39.184.192","10.1.3.206","TCP","1514","443  >  58444 [ACK] Seq=76498 Ack=7170 Win=673 Len=1460 [TCP PDU reassembled in 173]"
"161","5.999292500","23.39.184.192","10.1.3.206","TCP","1514","443  >  58444 [ACK] Seq=77958 Ack=7170 Win=673 Len=1460 [TCP PDU reassembled in 173]"
"162","5.999292500","23.39.184.192","10.1.3.206","TCP","1514","443  >  58444 [ACK] Seq=79418 Ack=7170 Win=673 Len=1460 [TCP PDU reassembled in 173]"
"163","5.999292500","23.39.184.192","10.1.3.206","TCP","1514","443  >  58444 [ACK] Seq=80878 Ack=7170 Win=673 Len=1460 [TCP PDU reassembled in 173]"
"164","5.999292500","23.39.184.192","10.1.3.206","TCP","1514","443  >  58444 [PSH, ACK] Seq=82338 Ack=7170 Win=673 Len=1460 [TCP PDU reassembled in 173]"
"165","5.999521900","10.1.3.206","23.39.184.192","TCP","54","58444  >  443 [ACK] Seq=7170 Ack=75038 Win=511 Len=0"
"166","5.999619200","10.1.3.206","23.39.184.192","TCP","54","58444  >  443 [ACK] Seq=7170 Ack=77958 Win=511 Len=0"
"167","5.999671300","10.1.3.206","23.39.184.192","TCP","54","58444  >  443 [ACK] Seq=7170 Ack=80878 Win=511 Len=0"
"168","5.999730800","10.1.3.206","23.39.184.192","TCP","54","58444  >  443 [ACK] Seq=7170 Ack=83798 Win=511 Len=0"
"169","6.000196200","23.39.184.192","10.1.3.206","TCP","1514","443  >  58444 [ACK] Seq=83798 Ack=7170 Win=673 Len=1460 [TCP PDU reassembled in 173]"
"170","6.000196200","23.39.184.192","10.1.3.206","TCP","1514","443  >  58444 [ACK] Seq=85258 Ack=7170 Win=673 Len=1460 [TCP PDU reassembled in 173]"
"171","6.000196200","23.39.184.192","10.1.3.206","TCP","1514","443  >  58444 [ACK] Seq=86718 Ack=7170 Win=673 Len=1460 [TCP PDU reassembled in 173]"
"172","6.000196200","23.39.184.192","10.1.3.206","TCP","1514","443  >  58444 [ACK] Seq=88178 Ack=7170 Win=673 Len=1460 [TCP PDU reassembled in 173]"
"173","6.000196200","23.39.184.192","10.1.3.206","TLSv1.2","1514","Application Data, Application Data"
"174","6.000196200","23.39.184.192","10.1.3.206","TCP","1514","443  >  58444 [ACK] Seq=91098 Ack=7170 Win=673 Len=1460 [TCP PDU reassembled in 192]"
"175","6.000196200","23.39.184.192","10.1.3.206","TCP","1514","443  >  58444 [PSH, ACK] Seq=92558 Ack=7170 Win=673 Len=1460 [TCP PDU reassembled in 192]"
"176","6.000399900","10.1.3.206","23.39.184.192","TCP","54","58444  >  443 [ACK] Seq=7170 Ack=86718 Win=511 Len=0"
"177","6.000496700","10.1.3.206","23.39.184.192","TCP","54","58444  >  443 [ACK] Seq=7170 Ack=89638 Win=511 Len=0"
"178","6.000550200","10.1.3.206","23.39.184.192","TCP","54","58444  >  443 [ACK] Seq=7170 Ack=92558 Win=511 Len=0"
"179","6.001109400","23.39.184.192","10.1.3.206","TCP","1514","443  >  58444 [ACK] Seq=94018 Ack=7170 Win=673 Len=1460 [TCP PDU reassembled in 192]"
"180","6.001109400","23.39.184.192","10.1.3.206","TCP","1514","443  >  58444 [ACK] Seq=95478 Ack=7170 Win=673 Len=1460 [TCP PDU reassembled in 192]"
"181","6.001109400","23.39.184.192","10.1.3.206","TCP","1514","443  >  58444 [ACK] Seq=96938 Ack=7170 Win=673 Len=1460 [TCP PDU reassembled in 192]"
"182","6.001109400","23.39.184.192","10.1.3.206","TCP","1514","443  >  58444 [ACK] Seq=98398 Ack=7170 Win=673 Len=1460 [TCP PDU reassembled in 192]"
"183","6.001109400","23.39.184.192","10.1.3.206","TCP","1514","443  >  58444 [ACK] Seq=99858 Ack=7170 Win=673 Len=1460 [TCP PDU reassembled in 192]"
"184","6.001109400","23.39.184.192","10.1.3.206","TCP","1514","443  >  58444 [ACK] Seq=101318 Ack=7170 Win=673 Len=1460 [TCP PDU reassembled in 192]"
"185","6.001109400","23.39.184.192","10.1.3.206","TCP","1514","443  >  58444 [PSH, ACK] Seq=102778 Ack=7170 Win=673 Len=1460 [TCP PDU reassembled in 192]"
"186","6.001284700","10.1.3.206","23.39.184.192","TCP","54","58444  >  443 [ACK] Seq=7170 Ack=95478 Win=511 Len=0"
"187","6.001383900","10.1.3.206","23.39.184.192","TCP","54","58444  >  443 [ACK] Seq=7170 Ack=98398 Win=511 Len=0"
"188","6.001420400","10.1.3.206","23.39.184.192","TCP","54","58444  >  443 [ACK] Seq=7170 Ack=101318 Win=511 Len=0"
"189","6.001466600","10.1.3.206","23.39.184.192","TCP","54","58444  >  443 [ACK] Seq=7170 Ack=104238 Win=511 Len=0"
"190","6.001877300","34.120.250.63","10.1.3.206","QUIC","215","Protected Payload (KP0)"
"191","6.002137400","23.39.184.192","10.1.3.206","TCP","1514","443  >  58444 [ACK] Seq=104238 Ack=7170 Win=673 Len=1460 [TCP PDU reassembled in 192]"
"192","6.002137400","23.39.184.192","10.1.3.206","TLSv1.2","727","Application Data"
"193","6.002353000","10.1.3.206","23.39.184.192","TCP","54","58444  >  443 [ACK] Seq=7170 Ack=106371 Win=511 Len=0"
"194","6.011354200","10.1.3.206","23.39.184.192","TCP","66","56732  >  443 [SYN] Seq=0 Win=65535 Len=0 MSS=1460 WS=256 SACK_PERM"
"195","6.014638900","23.48.203.111","10.1.3.206","UDP","66","443  >  54583 Len=24"
"196","6.015765900","23.48.203.111","10.1.3.206","UDP","1494","443  >  54583 Len=1452"
"197","6.019727600","23.39.184.192","10.1.3.206","TCP","66","443  >  56732 [SYN, ACK] Seq=0 Ack=1 Win=64240 Len=0 MSS=1460 SACK_PERM WS=128"
"198","6.019935700","10.1.3.206","23.39.184.192","TCP","54","56732  >  443 [ACK] Seq=1 Ack=1 Win=65280 Len=0"
"199","6.019980100","10.1.3.206","32.192.166.14","TCP","66","62836  >  443 [SYN] Seq=0 Win=65535 Len=0 MSS=1460 WS=256 SACK_PERM"
"200","6.020495300","10.1.3.206","23.39.184.192","TLSv1.3","2162","Client Hello (SNI=www.walmart.com)"
"201","6.027273900","10.1.3.206","34.120.250.63","QUIC","78","Protected Payload (KP0), DCID=e251c7bb04693a95"
"202","6.028054600","10.1.3.206","23.39.184.192","TLSv1.2","6994","Application Data"
"203","6.028829900","23.39.184.192","10.1.3.206","TCP","60","443  >  56732 [ACK] Seq=1 Ack=2109 Win=68352 Len=0"
"204","6.029406400","32.192.166.14","10.1.3.206","TCP","66","443  >  62836 [SYN, ACK] Seq=0 Ack=1 Win=26883 Len=0 MSS=1460 SACK_PERM WS=256"
"205","6.029406400","23.39.184.192","10.1.3.206","TLSv1.3","318","Server Hello, Change Cipher Spec, Application Data, Application Data"
"206","6.029544400","10.1.3.206","32.192.166.14","TCP","54","62836  >  443 [ACK] Seq=1 Ack=1 Win=65280 Len=0"
"207","6.030036000","10.1.3.206","32.192.166.14","TLSv1.2","1951","Client Hello (SNI=api.teleparty.com)"
"208","6.030270300","10.1.3.206","23.39.184.192","TLSv1.3","134","Change Cipher Spec, Application Data"
"209","6.033854400","10.1.3.206","104.17.64.242","TLSv1.2","212","Application Data"
"210","6.033928100","10.1.3.206","104.17.64.242","TLSv1.2","93","Application Data"
"211","6.036412600","23.39.184.192","10.1.3.206","TCP","60","443  >  58444 [ACK] Seq=106371 Ack=8630 Win=673 Len=0"
"212","6.036412600","23.39.184.192","10.1.3.206","TCP","60","443  >  58444 [ACK] Seq=106371 Ack=10090 Win=663 Len=0"
"213","6.036412600","23.39.184.192","10.1.3.206","TCP","60","443  >  58444 [ACK] Seq=106371 Ack=11550 Win=653 Len=0"
"214","6.036412600","23.39.184.192","10.1.3.206","TCP","60","443  >  58444 [ACK] Seq=106371 Ack=13010 Win=643 Len=0"
"215","6.036412600","23.39.184.192","10.1.3.206","TCP","60","443  >  58444 [ACK] Seq=106371 Ack=14110 Win=675 Len=0"
"216","6.038477200","23.39.184.192","10.1.3.206","TCP","60","443  >  56732 [ACK] Seq=265 Ack=2189 Win=68352 Len=0"
"217","6.039363300","32.192.166.14","10.1.3.206","TCP","60","443  >  62836 [ACK] Seq=1 Ack=1898 Win=30720 Len=0"
"218","6.039363300","32.192.166.14","10.1.3.206","TLSv1.2","1514","Server Hello"
"219","6.039363300","32.192.166.14","10.1.3.206","TCP","1514","443  >  62836 [ACK] Seq=1461 Ack=1898 Win=30720 Len=1460 [TCP PDU reassembled in 221]"
"220","6.039582200","10.1.3.206","32.192.166.14","TCP","54","62836  >  443 [ACK] Seq=1898 Ack=2921 Win=65280 Len=0"
"221","6.040096600","32.192.166.14","10.1.3.206","TLSv1.2","1419","Certificate, Server Key Exchange, Server Hello Done"
"222","6.041080000","10.1.3.206","32.192.166.14","TLSv1.2","180","Client Key Exchange, Change Cipher Spec, Encrypted Handshake Message"
"223","6.041269200","10.1.3.206","32.192.166.14","TLSv1.2","153","Application Data"
"224","6.041436100","10.1.3.206","32.192.166.14","TLSv1.2","894","Application Data"
"225","6.041866700","10.1.3.206","23.48.203.111","UDP","74","54583  >  443 Len=32"
"226","6.042548400","104.17.64.242","10.1.3.206","TCP","60","443  >  49670 [ACK] Seq=1 Ack=198 Win=18 Len=0"
"227","6.042548400","104.17.64.242","10.1.3.206","TLSv1.2","93","Application Data"
"228","6.050172400","23.39.184.192","10.1.3.206","TLSv1.3","357","Application Data"
"229","6.050555800","32.192.166.14","10.1.3.206","TLSv1.2","258","New Session Ticket, Change Cipher Spec, Encrypted Handshake Message"
"230","6.050555800","32.192.166.14","10.1.3.206","TLSv1.2","132","Application Data"
"231","6.050663100","10.1.3.206","32.192.166.14","TCP","54","62836  >  443 [ACK] Seq=2963 Ack=4490 Win=65280 Len=0"
"232","6.050750800","10.1.3.206","32.192.166.14","TCP","54","62836  >  443 [ACK] Seq=2963 Ack=4568 Win=65280 Len=0"
"233","6.051619900","104.17.64.242","10.1.3.206","TLSv1.2","458","Application Data"
"234","6.051619900","104.17.64.242","10.1.3.206","TLSv1.2","1344","Application Data"
"235","6.051619900","104.17.64.242","10.1.3.206","TLSv1.2","85","Application Data"
"236","6.051714700","10.1.3.206","104.17.64.242","TCP","54","49670  >  443 [ACK] Seq=198 Ack=444 Win=255 Len=0"
"237","6.051807600","10.1.3.206","104.17.64.242","TCP","54","49670  >  443 [ACK] Seq=198 Ack=1765 Win=250 Len=0"
"238","6.052354700","10.1.3.206","32.192.166.14","TLSv1.2","92","Application Data"
"239","6.053030200","32.192.166.14","10.1.3.206","TLSv1.2","158","Application Data"
"240","6.061878300","34.120.250.63","10.1.3.206","QUIC","66","Protected Payload (KP0)"
"241","6.061878300","23.39.184.192","10.1.3.206","TLSv1.2","723","Application Data"
"242","6.061878300","23.39.184.192","10.1.3.206","TCP","1514","443  >  58444 [ACK] Seq=107040 Ack=14110 Win=675 Len=1460 [TCP PDU reassembled in 257]"
"243","6.061878300","23.39.184.192","10.1.3.206","TCP","1514","443  >  58444 [ACK] Seq=108500 Ack=14110 Win=675 Len=1460 [TCP PDU reassembled in 257]"
"244","6.061878300","23.39.184.192","10.1.3.206","TCP","1514","443  >  58444 [ACK] Seq=109960 Ack=14110 Win=675 Len=1460 [TCP PDU reassembled in 257]"
"245","6.062161200","23.39.184.192","10.1.3.206","TCP","1514","443  >  58444 [ACK] Seq=111420 Ack=14110 Win=675 Len=1460 [TCP PDU reassembled in 257]"
"246","6.062161200","23.39.184.192","10.1.3.206","TCP","1514","443  >  58444 [ACK] Seq=112880 Ack=14110 Win=675 Len=1460 [TCP PDU reassembled in 257]"
"247","6.062161200","23.39.184.192","10.1.3.206","TCP","1514","443  >  58444 [ACK] Seq=114340 Ack=14110 Win=675 Len=1460 [TCP PDU reassembled in 257]"
"248","6.062161200","23.39.184.192","10.1.3.206","TCP","1514","443  >  58444 [PSH, ACK] Seq=115800 Ack=14110 Win=675 Len=1460 [TCP PDU reassembled in 257]"
"249","6.062265100","10.1.3.206","23.39.184.192","TCP","54","58444  >  443 [ACK] Seq=14110 Ack=108500 Win=511 Len=0"
"250","6.062400200","10.1.3.206","23.39.184.192","TCP","54","58444  >  443 [ACK] Seq=14110 Ack=111420 Win=511 Len=0"
"251","6.062454200","10.1.3.206","23.39.184.192","TCP","54","58444  >  443 [ACK] Seq=14110 Ack=114340 Win=511 Len=0"
"252","6.062555800","10.1.3.206","23.39.184.192","TCP","54","58444  >  443 [ACK] Seq=14110 Ack=117260 Win=511 Len=0"
"253","6.062760600","23.39.184.192","10.1.3.206","TCP","1514","443  >  58444 [ACK] Seq=117260 Ack=14110 Win=675 Len=1460 [TCP PDU reassembled in 257]"
"254","6.062760600","23.39.184.192","10.1.3.206","TCP","1514","443  >  58444 [ACK] Seq=118720 Ack=14110 Win=675 Len=1460 [TCP PDU reassembled in 257]"
"255","6.062760600","23.39.184.192","10.1.3.206","TCP","1514","443  >  58444 [ACK] Seq=120180 Ack=14110 Win=675 Len=1460 [TCP PDU reassembled in 257]"
"256","6.062760600","23.39.184.192","10.1.3.206","TCP","1514","443  >  58444 [ACK] Seq=121640 Ack=14110 Win=675 Len=1460 [TCP PDU reassembled in 257]"
"257","6.062760600","23.39.184.192","10.1.3.206","TLSv1.2","400","Application Data"
"258","6.063059800","10.1.3.206","23.39.184.192","TCP","54","58444  >  443 [ACK] Seq=14110 Ack=120180 Win=511 Len=0"
"259","6.063121800","10.1.3.206","23.39.184.192","TCP","54","58444  >  443 [ACK] Seq=14110 Ack=123100 Win=511 Len=0"
"260","6.063340700","23.39.184.192","10.1.3.206","TLSv1.2","1514","Application Data"
"261","6.063340700","23.39.184.192","10.1.3.206","TCP","1514","443  >  58444 [ACK] Seq=124906 Ack=14110 Win=675 Len=1460 [TCP PDU reassembled in 275]"
"262","6.063340700","23.39.184.192","10.1.3.206","TCP","1514","443  >  58444 [ACK] Seq=126366 Ack=14110 Win=675 Len=1460 [TCP PDU reassembled in 275]"
"263","6.063340700","23.39.184.192","10.1.3.206","TCP","1514","443  >  58444 [ACK] Seq=127826 Ack=14110 Win=675 Len=1460 [TCP PDU reassembled in 275]"
"264","6.063340700","23.39.184.192","10.1.3.206","TCP","1514","443  >  58444 [ACK] Seq=129286 Ack=14110 Win=675 Len=1460 [TCP PDU reassembled in 275]"
"265","6.063340700","23.39.184.192","10.1.3.206","TCP","1514","443  >  58444 [ACK] Seq=130746 Ack=14110 Win=675 Len=1460 [TCP PDU reassembled in 275]"
"266","6.063340700","23.39.184.192","10.1.3.206","TCP","1514","443  >  58444 [PSH, ACK] Seq=132206 Ack=14110 Win=675 Len=1460 [TCP PDU reassembled in 275]"
"267","6.063540300","10.1.3.206","23.39.184.192","TCP","54","58444  >  443 [ACK] Seq=14110 Ack=124906 Win=511 Len=0"
"268","6.063612400","10.1.3.206","23.39.184.192","TCP","54","58444  >  443 [ACK] Seq=14110 Ack=127826 Win=511 Len=0"
"269","6.063643500","10.1.3.206","23.39.184.192","TCP","54","58444  >  443 [ACK] Seq=14110 Ack=130746 Win=511 Len=0"
"270","6.063669900","10.1.3.206","23.39.184.192","TCP","54","58444  >  443 [ACK] Seq=14110 Ack=133666 Win=511 Len=0"
"271","6.064136900","23.39.184.192","10.1.3.206","TCP","1514","443  >  58444 [ACK] Seq=133666 Ack=14110 Win=675 Len=1460 [TCP PDU reassembled in 275]"
"272","6.064136900","23.39.184.192","10.1.3.206","TCP","1514","443  >  58444 [ACK] Seq=135126 Ack=14110 Win=675 Len=1460 [TCP PDU reassembled in 275]"
"273","6.064136900","23.39.184.192","10.1.3.206","TCP","1514","443  >  58444 [ACK] Seq=136586 Ack=14110 Win=675 Len=1460 [TCP PDU reassembled in 275]"
"274","6.064136900","23.39.184.192","10.1.3.206","TCP","1514","443  >  58444 [ACK] Seq=138046 Ack=14110 Win=675 Len=1460 [TCP PDU reassembled in 275]"
"275","6.064136900","23.39.184.192","10.1.3.206","TLSv1.2","1514","Application Data, Application Data"
"276","6.064136900","23.39.184.192","10.1.3.206","TCP","1514","443  >  58444 [ACK] Seq=140966 Ack=14110 Win=675 Len=1460 [TCP PDU reassembled in 293]"
"277","6.064136900","23.39.184.192","10.1.3.206","TCP","1514","443  >  58444 [PSH, ACK] Seq=142426 Ack=14110 Win=675 Len=1460 [TCP PDU reassembled in 293]"
"278","6.064287900","10.1.3.206","23.39.184.192","TCP","54","58444  >  443 [ACK] Seq=14110 Ack=136586 Win=511 Len=0"
"279","6.064342400","10.1.3.206","23.39.184.192","TCP","54","58444  >  443 [ACK] Seq=14110 Ack=139506 Win=511 Len=0"
"280","6.064374800","10.1.3.206","23.39.184.192","TCP","54","58444  >  443 [ACK] Seq=14110 Ack=142426 Win=511 Len=0"
"281","6.065005900","23.39.184.192","10.1.3.206","TCP","1514","443  >  58444 [ACK] Seq=143886 Ack=14110 Win=675 Len=1460 [TCP PDU reassembled in 293]"
"282","6.065005900","23.39.184.192","10.1.3.206","TCP","1514","443  >  58444 [ACK] Seq=145346 Ack=14110 Win=675 Len=1460 [TCP PDU reassembled in 293]"
"283","6.065005900","23.39.184.192","10.1.3.206","TCP","1514","443  >  58444 [ACK] Seq=146806 Ack=14110 Win=675 Len=1460 [TCP PDU reassembled in 293]"
"284","6.065005900","23.39.184.192","10.1.3.206","TCP","1514","443  >  58444 [ACK] Seq=148266 Ack=14110 Win=675 Len=1460 [TCP PDU reassembled in 293]"
"285","6.065005900","23.39.184.192","10.1.3.206","TCP","1514","443  >  58444 [ACK] Seq=149726 Ack=14110 Win=675 Len=1460 [TCP PDU reassembled in 293]"
"286","6.065005900","23.39.184.192","10.1.3.206","TCP","1514","443  >  58444 [ACK] Seq=151186 Ack=14110 Win=675 Len=1460 [TCP PDU reassembled in 293]"
"287","6.065005900","23.39.184.192","10.1.3.206","TCP","1514","443  >  58444 [PSH, ACK] Seq=152646 Ack=14110 Win=675 Len=1460 [TCP PDU reassembled in 293]"
"288","6.065121500","10.1.3.206","23.39.184.192","TCP","54","58444  >  443 [ACK] Seq=14110 Ack=145346 Win=511 Len=0"
"289","6.065146000","10.1.3.206","23.39.184.192","TCP","54","58444  >  443 [ACK] Seq=14110 Ack=148266 Win=511 Len=0"
"290","6.065183000","10.1.3.206","23.39.184.192","TCP","54","58444  >  443 [ACK] Seq=14110 Ack=151186 Win=511 Len=0"
"291","6.065211600","10.1.3.206","23.39.184.192","TCP","54","58444  >  443 [ACK] Seq=14110 Ack=154106 Win=511 Len=0"
"292","6.065863700","23.39.184.192","10.1.3.206","TCP","1514","443  >  58444 [ACK] Seq=154106 Ack=14110 Win=675 Len=1460 [TCP PDU reassembled in 293]"
"293","6.065863700","23.39.184.192","10.1.3.206","TLSv1.2","1514","Application Data, Application Data"
"294","6.065863700","23.39.184.192","10.1.3.206","TCP","1514","443  >  58444 [ACK] Seq=157026 Ack=14110 Win=675 Len=1460 [TCP PDU reassembled in 307]"
"295","6.065863700","23.39.184.192","10.1.3.206","TCP","1514","443  >  58444 [ACK] Seq=158486 Ack=14110 Win=675 Len=1460 [TCP PDU reassembled in 307]"
"296","6.065863700","23.39.184.192","10.1.3.206","TCP","1514","443  >  58444 [ACK] Seq=159946 Ack=14110 Win=675 Len=1460 [TCP PDU reassembled in 307]"
"297","6.065863700","23.39.184.192","10.1.3.206","TCP","1514","443  >  58444 [ACK] Seq=161406 Ack=14110 Win=675 Len=1460 [TCP PDU reassembled in 307]"
"298","6.065863700","23.39.184.192","10.1.3.206","TCP","1514","443  >  58444 [PSH, ACK] Seq=162866 Ack=14110 Win=675 Len=1460 [TCP PDU reassembled in 307]"
"299","6.065968500","10.1.3.206","23.39.184.192","TCP","54","58444  >  443 [ACK] Seq=14110 Ack=157026 Win=511 Len=0"
"300","6.066000500","10.1.3.206","23.39.184.192","TCP","54","58444  >  443 [ACK] Seq=14110 Ack=159946 Win=511 Len=0"
"301","6.066031600","10.1.3.206","23.39.184.192","TCP","54","58444  >  443 [ACK] Seq=14110 Ack=162866 Win=511 Len=0"
"302","6.066723500","23.39.184.192","10.1.3.206","TCP","1514","443  >  58444 [ACK] Seq=164326 Ack=14110 Win=675 Len=1460 [TCP PDU reassembled in 307]"
"303","6.066723500","23.39.184.192","10.1.3.206","TCP","1514","443  >  58444 [ACK] Seq=165786 Ack=14110 Win=675 Len=1460 [TCP PDU reassembled in 307]"
"304","6.066723500","23.39.184.192","10.1.3.206","TCP","1514","443  >  58444 [ACK] Seq=167246 Ack=14110 Win=675 Len=1460 [TCP PDU reassembled in 307]"
"305","6.066723500","23.39.184.192","10.1.3.206","TCP","1514","443  >  58444 [ACK] Seq=168706 Ack=14110 Win=675 Len=1460 [TCP PDU reassembled in 307]"
"306","6.066723500","23.39.184.192","10.1.3.206","TCP","1514","443  >  58444 [ACK] Seq=170166 Ack=14110 Win=675 Len=1460 [TCP PDU reassembled in 307]"
"307","6.066723500","23.39.184.192","10.1.3.206","TLSv1.2","1514","Application Data, Application Data"
"308","6.066723500","23.39.184.192","10.1.3.206","TCP","1514","443  >  58444 [PSH, ACK] Seq=173086 Ack=14110 Win=675 Len=1460 [TCP PDU reassembled in 326]"
"309","6.066926200","10.1.3.206","23.39.184.192","TCP","54","58444  >  443 [ACK] Seq=14110 Ack=165786 Win=511 Len=0"
"310","6.067000100","10.1.3.206","23.39.184.192","TCP","54","58444  >  443 [ACK] Seq=14110 Ack=168706 Win=511 Len=0"
"311","6.067061200","10.1.3.206","23.39.184.192","TCP","54","58444  >  443 [ACK] Seq=14110 Ack=171626 Win=511 Len=0"
"312","6.067115100","10.1.3.206","23.39.184.192","TCP","54","58444  >  443 [ACK] Seq=14110 Ack=174546 Win=511 Len=0"
"313","6.067575200","23.39.184.192","10.1.3.206","TCP","1514","443  >  58444 [ACK] Seq=174546 Ack=14110 Win=675 Len=1460 [TCP PDU reassembled in 326]"
"314","6.067575200","23.39.184.192","10.1.3.206","TCP","1514","443  >  58444 [ACK] Seq=176006 Ack=14110 Win=675 Len=1460 [TCP PDU reassembled in 326]"
"315","6.067575200","23.39.184.192","10.1.3.206","TCP","1514","443  >  58444 [ACK] Seq=177466 Ack=14110 Win=675 Len=1460 [TCP PDU reassembled in 326]"
"316","6.067575200","23.39.184.192","10.1.3.206","TCP","1514","443  >  58444 [ACK] Seq=178926 Ack=14110 Win=675 Len=1460 [TCP PDU reassembled in 326]"
"317","6.067575200","23.39.184.192","10.1.3.206","TCP","1514","443  >  58444 [ACK] Seq=180386 Ack=14110 Win=675 Len=1460 [TCP PDU reassembled in 326]"
"318","6.067575200","23.39.184.192","10.1.3.206","TCP","1514","443  >  58444 [ACK] Seq=181846 Ack=14110 Win=675 Len=1460 [TCP PDU reassembled in 326]"
"319","6.067575200","23.39.184.192","10.1.3.206","TCP","1514","443  >  58444 [PSH, ACK] Seq=183306 Ack=14110 Win=675 Len=1460 [TCP PDU reassembled in 326]"
